Article Title,Author,Journal Title,ISSN,ISBN,Publication Date,Volume,Issue,First Page,Page Count,Accession Number,DOI,Publisher,Doctype,Subjects,Keywords,Abstract,PLink
"Immigrant Acculturation and Transnationalism: Israelis in the United States and Europe Compared.","Rebhun, Uzi","Journal for the Scientific Study of Religion",="00218294",,="Sep2014","53","3","613","23","97937301","10.1111/jssr.12135","Wiley-Blackwell","Article","ACCULTURATION; SOCIAL integration; TRANSNATIONALISM; IMMIGRANTS; RELIGIOUSNESS","Europe; immigration; religio‐ethnic identification; religio-ethnic identification; social integration; ties to homeland; United States","This article examines relations between social integration into host societies, religio-ethnic acculturation into group belonging, and ties to home country among Israeli émigrés in the United States and Europe. I use data from a 2009-2010 Internet survey into which I incorporated country-contextual characteristics. The results of multivariate analyses show that a social integration combining duration of residence abroad and local citizenship enhances religio-ethnic identification. Another measure of integration, social networks, deters group behaviors. All measures of general integration inhibit attachment to the home country, whereas religio-ethnic acculturation is largely insignificant for transnationalism. The religiosity of the new country does not influence immigrants' religio-ethnic patterns or homeland attachment. Insofar as group size is a significant determinant of particularistic behaviors, it weakens them. The more policy-based opportunities newcomers receive, the more they dissociate from group behaviors and homeland ties. Irrespective of individual and contextual factors, living in the United States encourages group affiliation more than living in Europe does. The results are discussed in reference to four working hypotheses-marginalization, integration, assimilation, and separation-and from a U.S.-European comparative perspective.","http://search.ebscohost.com.proxy-ub.rug.nl/login.aspx?direct=true&db=pbh&AN=97937301&site=ehost-live&scope=site"
"Immigrant acculturation and wellbeing across generations and settlement contexts in Canada.","Berry, John W.; Hou, Feng","International Review of Psychiatry",="09540261",,="Feb-Mar2021","33","1/2","140","14","148805051","10.1080/09540261.2020.1750801","Taylor & Francis Ltd","Article","CANADA; QUEBEC (Province); IMMIGRANTS -- Canada; ACCULTURATION; EMIGRATION & immigration; INTERGENERATIONAL relations; MENTAL health; CULTURAL pluralism; QUESTIONNAIRES; GOVERNMENT policy; WELL-being","Acculturation; Canada; generational; mental health; wellbeing","When immigrants settle into their new societies, variations in their wellbeing are commonly found, due to a number of factors: their generation; their specific settlement context; and their acculturation strategies. With respect to settlement context, the policy of multiculturalism in Canada and of interculturalism in Quebec, provide different contexts for immigrant acculturation and wellbeing. Acculturation strategies are assessed with measures of sense of belonging to Canada and to the province of residence: Canada and Province (strong sense of belonging to both); either Canada only or province only (strong belonging to one or to the other); and neither (strong to neither). Wellbeing is assessed by scales of Life Satisfaction and Mental Health. This study examines whether these context differences may be associated with variations in the acculturation strategies and wellbeing among immigrants and later generations. Samples of adult immigrants and subsequent generations were drawn from those who live in Québec and in the rest of Canada. The distribution of the four profiles among immigrants did not differ between Québec and the rest of Canada. However, among later generations, the 'Canada only' profile is lower, while the 'province only' is higher, in Québec than in the rest of Canada. These findings suggest a drawing away from identifying with Canada, and an increase in identifying with Québec, in later generations in Québec. This pattern is consistent with the goals of the different incorporation policies in Québec and the rest of Canada. Wellbeing was generally higher in the group with high sense of belonging to both Canada and Québec, and Mental Health was higher in Québec than in the Rest of Canada in all three generations. Implications of these findings for acculturation and settlement policy are discussed.","http://search.ebscohost.com.proxy-ub.rug.nl/login.aspx?direct=true&db=pbh&AN=148805051&site=ehost-live&scope=site"
"Immigrant acculturation attitudes and host country identification.","Nesdale, Drew; Mak, Anita S.","Journal of Community & Applied Social Psychology",="10529284",,="Nov/Dec2000","10","6","483","13","11820075","10.1002/1099-1298(200011/12)10:6<483::AID-CASP580>3.0.CO;2-0","Wiley-Blackwell","Article","AUSTRALIA; IMMIGRANTS; IDENTIFICATION (Psychology); ACCULTURATION; ETHNIC groups; REGRESSION analysis","acculturation; identity; immigration","This study assessed the efficacy of a model predicting the host country identification of members of immigrant groups. The model proposed that host country identification is primarily determined by the positivity of the immigrants' acculturation attitude towards living according to the standards and values of the host country, followed by the degree of acceptance by members of the dominant cultural group, the success immigrants experience in the new country, and the extent to which they choose to live within their ethnic environment rather than the wider society. The study included 602 adult immigrants from a number of countries (Vietnam, People's Republic of China, Hong Kong, Taiwan, Sri Lanka, and New Zealand), which varied in their cultural similarity to the host country, Australia. Results from a multiple regression analysis of participants' questionnaire responses revealed good support for the model. As expected, acculturation attitude towards Australia was the strongest predictor of host country identification, followed by acceptance by Australians, while extent of ethnic involvement was a significant negative predictor. The results also revealed ethnic identification as a significant positive predictor of host country identification. The importance of the relationship between acculturation attitudes and identification is discussed, together with immigrants' identification processes towards their ethnic group and the host country. Copyright © 2000 John Wiley & Sons, Ltd.","http://search.ebscohost.com.proxy-ub.rug.nl/login.aspx?direct=true&db=pbh&AN=11820075&site=ehost-live&scope=site"
"Immigrant Acculturation, Gender and Health Behavior: A Research Note.","Lopez-Gonzalez, Lorena; Aravena, Veronica C.; Hummer, Robert A.","Social Forces",="00377732",,="Sep2005","84","1","577","13","18558457","10.1353/sof.2005.0112","Oxford University Press / USA","Article","HEALTH behavior; IMMIGRANTS; LOGISTIC regression analysis; ACCULTURATION; SMOKING; ALCOHOL drinking",,"Previous research shows that the health behavior of immigrants is favorable to that of native-born adults in the United States. We utilize pooled data from the 1998-2001 National Health Interview Surveys and multinomial logistic regression techniques to build on this literature and examine the association between acculturation and immigrant smoking and alcohol use. We also examine how acculturation relates to health behaviors by gender. Results indicate that the health behavior of more acculturated immigrant women is less positive than that of less acculturated women. For men, acculturation seems to make little difference for health behavior. Thus, it is important to not only consider how acculturation is related to health, but how the acculturation process differs across population subgroups.","http://search.ebscohost.com.proxy-ub.rug.nl/login.aspx?direct=true&db=pbh&AN=18558457&site=ehost-live&scope=site"
"Immigrant Environmental Behaviors in New York City.","Pfeffer, Max J.; Stycos, J. Mayone","Social Science Quarterly (Wiley-Blackwell)",="00384941",,="Mar2002","83","1","64","18","6194797","10.1111/1540-6237.00071","Wiley-Blackwell","Article","IMMIGRANTS; ECOPHYSIOLOGY; ENVIRONMENTALISM; HYPOTHESIS; ECONOMIC status; ENVIRONMENTAL protection",,"Objective. This article compares environmental behaviors of immigrants and the native-born to answer questions about potential impacts of immigration on the U.S. environment. Methods. We consider immigrant/native-born differences in the likelihood of engaging in environmentally friendly behavior. With data from a survey of New York City residents, we test two hypotheses regarding environmental behavior: (1) controlling for environmental orientation, environmental knowledge, acculturation, community attachment, and economic status will reduce immigrant/native-born differences, and (2) controlling for race will increase immigrant/native-born differences. Results. Our analysis provided no support for the second hypothesis, but there were varied results for the first hypothesis depending on the type of environmental behavior considered. Conclusions. Our findings for New York City show that fears of immigrants being less likely to engage in environmentally friendly behaviors are unfounded. Of greater significance to environmental organizations is the lower level of immigrant involvement in environmentally oriented political behaviors, suggesting that continued immigration will present challenges both in making the environmental movement more ethnically diverse and in maintaining its vitality.","http://search.ebscohost.com.proxy-ub.rug.nl/login.aspx?direct=true&db=pbh&AN=6194797&site=ehost-live&scope=site"
"Immigrant identity of Israeli adolescents from Ethiopia and the former USSR: culture-specific principles of organization.","Orr, Emda; Mana, Adi; Mana, Yosef","European Journal of Social Psychology",="00462772",,="Jan2003","33","1","71","22","11830343","10.1002/ejsp.132","Wiley-Blackwell","Article","ETHIOPIA; RUSSIA; GROUP identity; TEENAGE immigrants; HIGH school students; ACCULTURATION; ORGANIZATIONAL behavior",,"The study examines how a sample of 210 high-school immigrant students (ages 14–15) from Ethiopia and the former USSR socially represent their notion of what klitat aliyah (successful adaptation to Israel) means. Prevalent relevant theories—Berry's model of Acculturation Tendencies (BAT), Social Identity Theory (SIT) and Social Comparison Theory (SCT)—suggest three kinds of patterns by which minority or socially weak groups deal with these kinds of situations. These underlying patterns were tested by a 47-item questionnaire (with a 4-point Likert-like scale), constructed from immigrant narratives regarding their klitat aliyah according to SIT, SCT and BAT categories of adaptation strategies. A Guttman non-parametric Similarity Structure Analysis (SSA) revealed four-facet organization of items for both males and females in both sub-samples. These facets, which reflected social representations of Israeli society, were dubbed: Extended Identity, Rivalry Identity, Secluded Identity and Identity Loss. Results did not confirm the underlying categorization of strategies suggested by SIT and SCT, and partially replicated those suggested by BAT. Copyright © 2002 John Wiley & Sons, Ltd.","http://search.ebscohost.com.proxy-ub.rug.nl/login.aspx?direct=true&db=pbh&AN=11830343&site=ehost-live&scope=site"
"Immigrant Job Hunting, Labour Market Experiences, and Feelings about Occupational Satisfaction in New Zealand: An Exploratory Study.","Mace, Karen A.; Atkins, Stephen; Fletcher, Richard; Carr, Stuart C.","New Zealand Journal of Psychology",="0112109X",,="Jul2005","34","2","97","13","18509565",,"New Zealand Psychological Society","Article","NEW Zealand; IMMIGRANTS; JOB satisfaction; LABOR market; EMPLOYMENT interviewing; JOB hunting",,"We investigated how an integrated model of often under- or un-employed immigrants' (a) job-hunting behaviours pre-interview, (b) positive behaviours used at interview, (c) cognitive flexibility, (d) acculturation style, and (e) acculturation 'fit' between (d) and employers' preferred style of acculturation for immigrants to adopt, predict how close immigrants come to finding full employment; and how this proximity to full employment may relate to broader feelings about occupational life. Seventy predominantly skilled immigrants to New Zealand provided indices of (a) to (d) through a sample survey, whilst (e) was measured with the added assistance of 20 experienced recruitment agencies, interviewed by telephone. Path analysis suggested that feelings about occupational life are related to proximity to full employment, which is itself predicted by a combination of (a) and (d), but not (b), (c) or (e). Links between proximity to employment and feelings about occupational life in New Zealand were unexpectedly negative, but only moderately stable. Our findings may challenge some of the received wisdom in the vocational literature, but are nonetheless consistent with implicit prejudice from prospective employers, and with a lived vocational experience of relative deprivation amongst immigrants themselves.","http://search.ebscohost.com.proxy-ub.rug.nl/login.aspx?direct=true&db=pbh&AN=18509565&site=ehost-live&scope=site"
"Immigrant Women's Experiences of Acculturative Stress: Ordinary Privileges, Overt Discrimination, and Psychological Well-Being.","Greenwood, Ronni Michelle; Adshead, Maura; Jay, Sarah","Psychology of Women Quarterly",="03616843",,="Dec2017","41","4","497","16","126726788","10.1177/0361684317719733","Sage Publications Inc.","Article","IRELAND; ACCULTURATION; ACTION research; CHI-squared test; EMIGRATION & immigration; FACTOR analysis; QUESTIONNAIRES; RELIABILITY (Personality trait); STATISTICAL sampling; SATISFACTION; SCALE analysis (Psychology); STATISTICS; PSYCHOLOGICAL stress; WOMEN; DATA analysis; WELL-being; DATA analysis software; DESCRIPTIVE statistics","discrimination; immigrants; intersectionality; privilege; psychiatric symptoms; satisfaction with life","We examined the relation of two acculturation stressors, exclusion from ordinary privileges and overt discrimination, to two indicators of psychological well-being (i.e., psychiatric symptoms and satisfaction with life) among a diverse sample of immigrant women living in Ireland (N = 174). We grouped our sample into ""visible"" immigrant women of color and ""nonvisible"" White immigrant women. As expected, visible immigrant women reported more experiences of overt discrimination and fewer experiences of ordinary privileges than did nonvisible immigrant women. The associations of belonging to a visible immigrant group with both psychiatric symptoms and satisfaction with life were each mediated through ordinary privileges and overt discrimination. The magnitude of the two indirect effects was equal for psychiatric symptoms, but for satisfaction with life, the indirect effect through ordinary privileges was stronger. After accounting for ordinary privileges and overt discrimination, the average score for satisfaction with life was higher for visible immigrant women than for nonvisible immigrant women. These findings suggest that visible immigrant women experience exclusion from ordinary privileges to a greater extent than nonvisible immigrant women and that this type of exclusion is at least as detrimental to psychological health as more overt forms of discrimination. Our findings demonstrate the importance of attending to discrimination of both visible and nonvisible immigrants and highlight the importance of ordinary privileges to immigrants' well-being in their countries of destination. We discuss implications for future research and social policy.","http://search.ebscohost.com.proxy-ub.rug.nl/login.aspx?direct=true&db=pbh&AN=126726788&site=ehost-live&scope=site"
"Immigrants' Health, Acculturation, and the Work–Retirement Continuum.","Zlotnick, Cheryl; Dryjanska, Laura","Health & Social Work",="03607283",,="Feb2020","45","1","13","10","141627913","10.1093/hsw/hlz039","Oxford University Press / USA","Article","ISRAEL; IMMIGRANTS -- Israel; ACCULTURATION; ATTITUDE (Psychology); CHI-squared test; COMMUNICATIVE competence; COMPARATIVE studies; CONFIDENCE intervals; CORRELATION (Statistics); EMPLOYMENT; GROUP identity; HEALTH promotion; HEALTH status indicators; INDUSTRIAL hygiene; JOB descriptions; LANGUAGE & languages; MOTIVATION (Psychology); MULTIVARIATE analysis; QUESTIONNAIRES; RETIREMENT; STATISTICAL sampling; SELF-evaluation; SELF-perception; SOCIAL workers; STATISTICS; WORK; LOGISTIC regression analysis; RESIDENTIAL patterns; CROSS-sectional method; DATA analysis software; DESCRIPTIVE statistics; ODDS ratio","acculturation; expectations; occupational health; retirement; self-reported health status","Although the link between immigrants' health status and employment is well established, there is little information on the combined impact of three components of acculturation (that is, dual self-identity, language proficiency, and realized expectations) on this link. Immigrants who came to Israel from English-speaking countries (N = 377) were categorized into three groups based on the work–retirement continuum (that is, working, same occupation; working, changed occupation; or retired). Using a cross-sectional design, this study examined whether the link between health and acculturation varied by immigrants' location on the work–retirement continuum. Bivariate analyses revealed group differences for two acculturation components, language proficiency (p <.0001) and dual self-identity (p <.05). Multivariable analyses indicated an interaction effect between the acculturation component of realized expectations and work–retirement continuum group status on health status. As a result, good health was related to higher levels of realized expectations for the retired group; related to lower levels of realized expectations for the ""working, changed occupations"" group; and unrelated to realized expectations for the ""working, same occupation"" group. The acculturation component of realized expectations varies depending on the immigrant's location on the work–retirement continuum. Health and social welfare professionals can promote health in working or retired immigrants by providing clear and realistic information to better align with immigrants' expectations.","http://search.ebscohost.com.proxy-ub.rug.nl/login.aspx?direct=true&db=pbh&AN=141627913&site=ehost-live&scope=site"
"Immigration and Mental Health: Mexican Americans in the United States.","Escobar, Javier I.; Nervi, Constanza Hoyos; Gara, Michael A.","Harvard Review of Psychiatry",="10673229",,="Jul2000","8","2","64","9","10909763","10.1080/hrp_8.2.64","Lippincott Williams & Wilkins","Article","UNITED States; MENTAL health services for Mexican Americans; IMMIGRANTS -- Medical care; EMIGRATION & immigration",,"The Hispanic population in the United States continues to expand rapidly due primarily to a large flow of immigrants from Mexico. Historical observations of disadvantage in the immigrant population, when compared to the native population, had helped to shape prevailing theories on immigration and mental health. However, data emerging from new research on Mexican Americans have come to challenge the old idea that immigrants are necessarily disadvantaged. The goal of this article is to review these new studies critically, to draw conclusions concerning the relationship between immigration and psychopathology, and to offer potential explanations for the major findings. We review five recent large-scale studies that examined the prevalence of mental disorders among Mexican-born immigrants and U.S.-born Mexican Americans in the United States. Results of these studies are inconsistent with traditional tenets on the relationship among immigration, acculturation, and psychopathology. They show that Mexico-born immigrants, despite significant socioeconomic disadvantages, have better mental health profiles than do U.S.-born Mexican Americans. Possible explanations for the better mental health profile of Mexican immigrants include research artifacts such as selection bias, a protective effect of traditional family networks, and a lower set of expectations about what constitutes ""success"" in America. The elevated rates of psychopathology in U.S.-born Mexican Americans may be related to easier access to abused substances and an elevated frequency of substance abuse among the U.S.-born.","http://search.ebscohost.com.proxy-ub.rug.nl/login.aspx?direct=true&db=pbh&AN=10909763&site=ehost-live&scope=site"
"Immigration and Sleep Problems in a Southern European Country: Do Immigrants Get the Best Sleep?","Villarroel, Nazmy; Artazcoz, Lucía","Behavioral Medicine",="08964289",,="2017","43","4","233","9","125462177","10.1080/08964289.2015.1122568","Taylor & Francis Ltd","Article","ARGENTINA; BOLIVIA; COLOMBIA; ECUADOR; MOROCCO; PERU; ROMANIA; SPAIN; ACCULTURATION; DISCRIMINATION; IMMIGRANTS -- Psychology; INSOMNIA; SEX distribution; SLEEP disorders; RESIDENTIAL patterns; LIFESTYLES; DISEASE prevalence","gender; immigrants; sleep disorders; socio-economic factors; Spain","This study analyzes the differences in the prevalence of insomnia symptoms and nonrestorative sleep (NRS) between people born in Spain and immigrants from 7 countries with most immigrants in Spain. Data come from the 2006 Spanish National Health Survey. The sample was composed of all individuals aged 16 to 64 years from Spain and the 7 countries with most immigrants in Spain (N = 22,224). In both sexes, people from Bolivia had a higher prevalence of insomnia symptoms and NRS. Conversely, people from Ecuador, Morocco, and Romania had less insomnia symptoms and NRS than Spanish-born participants. No differences were found between Spanish-born participants and Colombian, Peruvian, and Argentinian women. Poor living conditions in the country of origin and in the host country, discrimination, and culturally related lifestyles could be related to poorer sleep health among Bolivian men. Acculturation may explain the similar sleep health patterns noted between Spanish-born participants and long-term immigrants.","http://search.ebscohost.com.proxy-ub.rug.nl/login.aspx?direct=true&db=pbh&AN=125462177&site=ehost-live&scope=site"
"Immigration Transition and Depressive Symptoms: Four Major Ethnic Groups of Midlife Women in the United States.","Im, Eun-Ok; Chang, Sun Ju; Chee, Wonshik; Chee, Eunice; Mao, Jun James","Health Care for Women International",="07399332",,="Apr2015","36","4","439","18","101893094","10.1080/07399332.2014.924518","Taylor & Francis Ltd","Article","UNITED States; ACCULTURATION; ANALYSIS of variance; MENTAL depression; EMIGRATION & immigration; ETHNIC groups; QUESTIONNAIRES; SCALE analysis (Psychology); SELF-evaluation; STATISTICS; SURVEYS; T-test (Statistics); SAMPLE size (Statistics); DATA analysis; MULTIPLE regression analysis; SECONDARY analysis; EFFECT sizes (Statistics); RELATIVE medical risk; SEVERITY of illness index; DESCRIPTIVE statistics; INFERENTIAL statistics",,"The purpose of this study was to explore the relationships between immigration transition and depressive symptoms among 1,054 midlife women in the United States. This was a secondary analysis of the data from two national Internet survey studies. Questions on background characteristics and immigration transition and the Depression Index for Midlife Women were used to collect the data. The data were analyzed using inferential statistics including multiple regressions. Immigrants reported lower numbers of symptoms and less severe symptoms than nonimmigrants (p <.01). When controlling for background characteristics, self-reported racial/ethnic identity and immigration status were significant predictors of depressive symptoms (R2 =.01, p <.05).","http://search.ebscohost.com.proxy-ub.rug.nl/login.aspx?direct=true&db=pbh&AN=101893094&site=ehost-live&scope=site"
"Importation, SES-selective acculturation, and the weaker SES-health gradients of Mexican immigrants in the United States","Riosmena, Fernando; Dennis, Jeff A.","Social Science Journal",="03623319",,="Sep2012","49","3","325","5","82198925","10.1016/j.soscij.2012.01.004","Taylor & Francis Ltd","Article","UNITED States; ACCULTURATION; IMMIGRANTS; HEALTH surveys; SOCIOECONOMIC factors; SOCIAL status; HEALTH status indicators; HYPOTHESIS",,"Abstract: Previous studies find U.S. immigrants have weaker socioeconomic gradients in health relative to non-Hispanic Whites and their U.S.-born co-ethnics. Several explanations have been advanced but few have been tested empirically. We use data from the Mexican Family Life Survey and the U.S. National Health Interview Survey, including longitudinal data in the former measuring socioeconomic status (SES) and health previous to emigration, to test if (1) immigrants “import” their gradients from the sending country, or if (2) they may be changing as a result of SES-graded acculturation among Mexican migrant men in two health indicators: obesity and current smoking. We find evidence consistent with the first hypothesis: the gradients of migrants measured prior to coming to the U.S. are not statistically different from those of nonmigrants, as the gradients of each are relatively weak. Although the gradients for obesity and smoking appear to weaken with time spent in the U.S., the differences are not significant, suggesting little support for the selective acculturation hypothesis.","http://search.ebscohost.com.proxy-ub.rug.nl/login.aspx?direct=true&db=pbh&AN=82198925&site=ehost-live&scope=site"
