Article Title,Author,Journal Title,ISSN,ISBN,Publication Date,Volume,Issue,First Page,Page Count,Accession Number,DOI,Publisher,Doctype,Subjects,Keywords,Abstract,PLink
"A bidimensional model of acculturation for Korean American older adults","Jang, Yuri; Kim, Giyeon; Chiriboga, David; King-Kallimanis, Bellinda","Journal of Aging Studies",="08904065",,="Aug2007","21","3","267","9","25596006","10.1016/j.jaging.2006.10.004","Elsevier B.V.","Article","UNITED States; ASSIMILATION (Sociology); ACCULTURATION; ETHNOLOGY -- United States","Bidimensional model of acculturation; Korean American older adults","Abstract: With the growth of immigrant populations and the increasing awareness and appreciation for the cultural diversity in the U.S., the present study assessed a model of acculturation with a sample of Korean American older adults. We addressed a bidimensional model of acculturation, considering both orientations toward home and host cultures, and assessed the relevance of Berry''s four-cell typology of acculturation (integration, assimilation, separation, and marginalization). Based on the unique characteristics of the present sample, including that they were all born in Korea and had been exposed to their home culture for a substantial amount of time, we hypothesized that their orientation towards original culture would be strong and that simple application of Berry''s four-cell typology would not be relevant. As expected, scores on Korean orientation were distributed toward the high end of the scale, suggesting a high level of familiarity and adherence to the original culture; scores on American orientation were correspondingly low. Cluster analysis showed that a two-cluster model was an optimal group classification in the sample used in this investigation. The groups were identified as “integrated group” and “separated group.” Compared to the separated group, integrated group was more likely to be younger, married, and educated. More years of residence in the U.S. and better physical and mental health were observed among those who were integrated. The findings call attention to the needs to consider the unique nature of immigrant samples in order to adequately apply the acculturation typologies.","http://search.ebscohost.com.proxy-ub.rug.nl/login.aspx?direct=true&db=pbh&AN=25596006&site=ehost-live&scope=site"
"A national study of gender and racial differences in colorectal cancer screening among foreign-born older adults living in the US.","Cofie, Leslie E.; Hirth, Jacqueline M.; Cuevas, Adolfo G.; Farr, Deeonna","Journal of Behavioral Medicine",="01607715",,="Jun2020","43","3","460","8","143245312","10.1007/s10865-019-00107-3","Springer Nature","Article","UNITED States; IMMIGRANTS -- United States; HEALTH services accessibility -- United States; ACCULTURATION; CITIZENSHIP; COLON tumors; COMPARATIVE studies; CONFIDENCE intervals; ETHNIC groups; HEALTH services accessibility; HEALTH status indicators; HISPANIC Americans; INTERVIEWING; RACE; RECTUM tumors; SEX distribution; SURVEYS; WHITE people; MULTIPLE regression analysis; EARLY detection of cancer; ODDS ratio","Cancer screening; Colorectal cancer; Gender; Immigrants; Older adults; Racial/ethnic minorities","This study examined within group heterogeneity in colorectal cancer screening (CRCS) among foreign-born individuals. Data were from the 2010, 2013 and 2015 National Health Interview Survey data on older adults (N = 5529). In 2018, multivariable logistic regression analysis was conducted to determine whether gender and race/ethnicity were associated with CRCS after controlling for sociodemographic, health access, and acculturation related factors. Overall, Asians were significantly less likely to report CRCS compared with Whites (aOR 0.63, CI 0.52–0.76). Hispanic race/ethnicity was negatively associated with CRCS among men (aOR 0.68, CI 0.50–0.91), but not women compared to white men/women, respectively. Additionally, factors associated with CRCS include having fair/poor health, usual source of care, insurance, ≥ 10 years of US residency and citizenship. Screening disparities experienced by these immigrants may be addressed by improving healthcare access, especially for noncitizens and those with limited healthcare access.","http://search.ebscohost.com.proxy-ub.rug.nl/login.aspx?direct=true&db=pbh&AN=143245312&site=ehost-live&scope=site"
"A person-centered and ecological investigation of acculturation strategies in Hispanic immigrant youth.","Coatsworth, J. Douglas; Maldonado-Molina, Mildred; Pantin, Hilda; Szapocznik, José","Journal of Community Psychology",="00904392",,="Mar2005","33","2","157","18","15806330","10.1002/jcop.20046","Wiley-Blackwell","Article","ETHNICITY; ANTHROPOLOGY; CIVILIZATION; ASSIMILATION (Sociology); ACCULTURATION; CULTURAL pluralism",,"Understanding the processes of acculturation in ethnic minority populations is one of the central tasks of crosscultural research. Addressing challenges of theory, methods, and application in acculturation research requires ongoing advancements in methods and theoretical and model development. The current study was designed to explain a person-centered approach to investigating acculturation and biculturalism and to illustrate this method with a sample of 315 Hispanic youth. Pattern analyses of the Hispanicism and Americanism scores from the Bicultural Involvement Scale yielded four distinct acculturation types, including one characterized by moderate scores on both scales. Relations between acculturation types and indicators of individual, family, and peer adaptation were tested. Results indicated that bicultural youth tended to show the most adaptive pattern of functioning across multiple sociocultural domains. Assimilated youth did not show as strongly negative a pattern as has been reported elsewhere. Implications and benefits of a person-centered approach are discussed. © 2005 Wiley Periodicals, Inc. J Comm Psychol 33: 157–174, 2005.","http://search.ebscohost.com.proxy-ub.rug.nl/login.aspx?direct=true&db=pbh&AN=15806330&site=ehost-live&scope=site"
"A systematic review of correlates of depression among older Chinese and Korean immigrants: what we know and do not know.","Guo, Man; Stensland, Meredith","Aging & Mental Health",="13607863",,="Dec2018","22","12","1535","13","134609583","10.1080/13607863.2017.1383971","Taylor & Francis Ltd","Article","CHINA; KOREA; UNITED States; MENTAL depression risk factors; ACCULTURATION; CINAHL (Information retrieval system); FAMILIES; IMMIGRANTS -- Psychology; PSYCHOLOGY information storage & retrieval systems; MEDLINE; MENTAL health; MULTIVARIATE analysis; ONLINE information services; SYSTEMATIC reviews (Medical research); ASIANS; SOCIAL support; OLD age; PSYCHOLOGY","Asian Americans; Depression; family support; immigrants; social support","Objectives: Guided by the stress and coping theory, this study provides a systematic review of existing research on acculutration, family support, and social support related correlates of depression among older Chinese and Korean immigrants in the United States. Method: A comprehensive literature search was conducted in CINAHL Plus, Abstracts in Social Gerontology, AgeLine, Social Work Abstracts, PubMed, PsychINFO, and Social Science Citation Index databases to identify relevant articles that presented multivariate analysis results. Results: A total of 55 articles were identified, with the vast majority focusing on older Korean immigrants. The overall evidence showed that length of residence was largely unrelated to depression, and poor Enligsh proficiency also had a weak correlation with depression. However, a low level of acculturation measured by multidimensional scales was consistently associated with more depressive symptoms. Overall, living arrangements and the size and frequency of contact of both kin and non-kin networks were weak correlates of depression. In contrast, negative family and social interactions seem to be more consequential for depression in the two groups than positive relations and support. Conclusion: The findings show that established acculturation instruments are useful tools to identify at-risk older Chinese and Korean immigrants. Future studies need to further examine which aspects of acculturation experience are more influential for immigrants' mental health. Although often conceptualized as important coping resources, family and social networks could present significant stressors for older immigrants. Future research and services could focus on these contexts to improve the mental health of these two rapidly increasing Asian populations.","http://search.ebscohost.com.proxy-ub.rug.nl/login.aspx?direct=true&db=pbh&AN=134609583&site=ehost-live&scope=site"
"Access to and Use of Health Services Among Undocumented Mexican Immigrants in a US Urban Area.","Nandi, Arijit; Galea, Sandra; Lopez, Gerald; Nandi, Vijay; Strongarone, Stacey; Ompad, Danielle C.","American Journal of Public Health",="00900036",,="Nov2008","98","11","2011","10","35119067","10.2105/AJPH.2006.096222","American Public Health Association","Article","NEW York (N.Y.); NEW York (State); UNITED States; UNDOCUMENTED immigrants -- United States; UNDOCUMENTED immigrants -- Medical care; EMERGENCY medical services; MEDICAL care; PUBLIC health -- United States",,"Objectives. We assessed access to and use of health services among Mexican-born undocumented immigrants living in New York City in 2004. Methods. We used venue-based sampling to recruit participants from locations where undocumented immigrants were likely to congregate. Participants were 18 years or older, born in Mexico, and current residents of New York City. The main outcome measures were health insurance coverage, access to a regular health care provider, and emergency department care. Results. In multivariable models, living in a residence with fewer other adults, linguistic acculturation, higher levels of formal income, higher levels of social support, and poor health were associated with health insurance coverage. Female gender, fewer children, arrival before 1997, higher levels of formal income, health insurance coverage, greater social support, and not reporting discrimination were associated with access to a regular health care provider. Higher levels of education, higher levels of formal income, and poor health were associated with emergency department care. Conclusions. Absent large-scale political solutions to the challenges of undocumented immigrants, policies that address factors shown to limit access to care may improve health among this growing population. (Am J Public Health. 2008;98:2011-2020. doi:10.2105/AJPH.2006.096222)","http://search.ebscohost.com.proxy-ub.rug.nl/login.aspx?direct=true&db=pbh&AN=35119067&site=ehost-live&scope=site"
"Acculturation and bicultural efficacy effects on Chinese American immigrants' diabetes and health management.","Chun, Kevin; Kwan, Christine; Strycker, Lisa; Chesla, Catherine","Journal of Behavioral Medicine",="01607715",,="Oct2016","39","5","896","12","117902115","10.1007/s10865-016-9766-2","Springer Nature","Article","UNITED States; ACCULTURATION; CHI-squared test; CONFIDENCE; MENTAL depression; DISTRESS (Psychology); HEALTH surveys; TYPE 2 diabetes; PROBABILITY theory; PSYCHOLOGICAL tests; PSYCHOMETRICS; QUALITY of life; QUESTIONNAIRES; REGRESSION analysis; RESEARCH funding; SATISFACTION; PSYCHOLOGICAL stress; DISEASE management; ASIANS; SOCIAL support; SYMPTOMS; DATA analysis software; GLYCEMIC control; PSYCHOLOGY","Acculturation; Bicultural efficacy; Chinese American; Diabetes; Immigrant health","The article presents a study that examined the effects of bicultural efficacy or perceived confidence in dealing with bicultural acculturation stressors on type 2 diabetes management and health for first-generation, Cantonese-speaking, Chinese American immigrants. Topics discussed include testing the new Bicultural Efficacy in Health Management (BEFF-HM) scale as a more robust predictor of diabetes and health outcomes than proxy and general acculturation measures.","http://search.ebscohost.com.proxy-ub.rug.nl/login.aspx?direct=true&db=pbh&AN=117902115&site=ehost-live&scope=site"
"Acculturation and Its Relationship to Smoking and Breast Self-Examination Frequency in African American Women.","Guevarra, Josephine; Kwate, Naa; Tang, Tricia; Valdimarsdottir, Heiddis; Freeman, Harold; Bovbjerg, Dana","Journal of Behavioral Medicine",="01607715",,="Apr2005","28","2","191","9","16902742","10.1007/s10865-005-3668-z","Springer Nature","Article","ACCULTURATION; SMOKING; MEDICAL self-examination; AFRICAN American women; TOBACCO use; AMERICAN women; PREVENTIVE medicine","acculturation; African American; breast self exam; smoking","The concept of acculturation has been used to understand differences in health behaviors between and within a variety of racial and ethnic immigrant groups. Few studies, however, have examined the potential impact of acculturation on health behaviors among African Americans. The present study has two goals: 1) to reconfirm relations between acculturation and cigarette smoking; 2) to investigate the impact of acculturation on another type of health behavior, cancer screening and specifically breast self-examination (BSE). African American women (N= 66) attending an inner-city cancer-screening clinic completed study questionnaires. Results reconfirmed psychometric properties of the African American Acculturation Scale (AAAS); replicated the negative association between acculturation and lifetime smoking status; and found relations between acculturation and women’s adherence to BSE frequency guidelines. Findings from this study raise the possibility that specific aspects of acculturation may better explain specific health behaviors.","http://search.ebscohost.com.proxy-ub.rug.nl/login.aspx?direct=true&db=pbh&AN=16902742&site=ehost-live&scope=site"
"Acculturation and Low-Birthweight Infants among Latino women: A Reanalysis of HHANES Data with Structural Equation Models.","Cobas, José A.; Balcazar, Hector; Benin, Mary B.; Keith, Verna M.; Yinong Chong","American Journal of Public Health",="00900036",,="Mar1996","86","3","394","3","9604032297","10.2105/AJPH.86.3.394","American Public Health Association","Article","ACCULTURATION; LOW birth weight; MOTHERS; IMMIGRANTS; HISPANIC Americans; SMOKING; DIET",,"Previous studies have demonstrated that acculturation is associated with negative birth outcomes among mothers in numerous immigrant populations, including Latinas. This study used structural equation models to reanalyze data employed in the 1989 Scribner and Dwyer study on the effect of acculturation (measured through the Cuellar scale) on mothers' low-birthweight status. Data revealed that language components dominate the effects of acculturation on low-birthweight status. Acculturation appears to affect low-birth- weight status indirectly through smoking and dietary intake but not through parity. Acculturation has a persistent direct effect on low -birthweight status, suggesting that other intervening variables are operant.","http://search.ebscohost.com.proxy-ub.rug.nl/login.aspx?direct=true&db=pbh&AN=9604032297&site=ehost-live&scope=site"
"Acculturation and Personality as Predictors of Stress in Japanese and Japanese-Americans.","Padilla, Amado M.; Wagatsuma, Yuria; Lindholm, Kathryn J.","Journal of Social Psychology",="00224545",,="Jun1985","125","3","295","11","5392601","10.1080/00224545.1985.9922890","Taylor & Francis Ltd","Article","PSYCHOLOGICAL stress; PERSONALITY; CONSCIOUSNESS; MENTAL health; JAPANESE; SELF-esteem",,"The experience of stress and personality variables among 114 Japanese and Japanese-American students undergoing differing degrees of acculturation was studied. Self-esteem, introversion-extraversion, and locus of control were measured with standard instruments. A stress scale designed for immigrant students was used as well as new scales for acculturation and values. Students were grouped into first, second, and third/later generations. Results from several analyses indicated that different generational groups reported different levels of stress, values, and acculturation. In addition, generational groups differed in self-esteem and locus of control: First-generation students experienced the most stress, were low in self-esteem, and were more externally oriented than third/later generation students. Also, self-esteem and acculturation level were good predictors of stress in all generations.","http://search.ebscohost.com.proxy-ub.rug.nl/login.aspx?direct=true&db=pbh&AN=5392601&site=ehost-live&scope=site"
"Acculturation and quality of life among Chinese American breast cancer survivors: The mediating role of self-stigma, ambivalence over emotion expression, and intrusive thoughts.","Tsai, William; Wu, Ivan H.C.; Lu, Qian","Psycho-Oncology",="10579249",,="May2019","28","5","1063","8","136270525","10.1002/pon.5053","Wiley-Blackwell","journal article","CHINESE Americans; BREAST cancer; CANCER patients; ACCULTURATION; QUALITY of life","acculturation; ambivalence over emotional expression; cancer; Chinese; intrusive thoughts; oncology; quality of life; self‐stigma","<bold>Objectives: </bold>Highly acculturated Chinese American breast cancer survivors have greater access to health care providers, are English language proficient, and have more knowledge about the health care system. However, less is known about the potential psychosocial factors that may account for the health benefits of acculturation. As such, the current study seeks to understand how mainstream acculturation is associated with higher quality of life by investigating self-stigma, ambivalence over emotion expression (AEE), and intrusive thoughts, as serial mediators among Chinese breast cancer survivors.<bold>Methods: </bold>One hundred twelve Chinese American breast cancer survivors completed a self-reported questionnaire with these trait variables.<bold>Results: </bold>We found support for a serial multiple mediation hypothesis in which mainstream acculturation was indirectly associated with quality of life through self-stigma, AEE, and intrusive thoughts. Specifically, mainstream acculturation was associated with lower self-stigma, which, in turn, was associated with lower AEE and intrusive thoughts and subsequently resulted in lower quality of life among Chinese American breast cancer survivors.<bold>Conclusions: </bold>The findings suggest that psychosocial factors are important mechanisms through which acculturation is associated with quality of life among Chinese American breast cancer survivors. As Chinese immigrants acculturate to mainstream American culture, they may benefit from the reduced public stigma toward breast cancer and incorporate new post-immigration knowledge about cancer that protects them from high levels of self-stigma. This, in turn, may lead Chinese American breast cancer survivors to experience lower AEE and intrusive thoughts and subsequently experience higher quality of life.","http://search.ebscohost.com.proxy-ub.rug.nl/login.aspx?direct=true&db=pbh&AN=136270525&site=ehost-live&scope=site"
"Acculturation and the Prevalence of Depression in Older Mexican Americans: Baseline Results of the Sacramento Area Latino Study on Aging.","González, Hector M.; Haan, Mary N.; Hinton, Ladson","Journal of the American Geriatrics Society",="00028614",,="Jul2001","49","7","948","6","5928486","10.1046/j.1532-5415.2001.49186.x","Wiley-Blackwell","Article","NORTHERN California; OLDER Mexican Americans; ACCULTURATION; EMIGRATION & immigration; DEPRESSION in old age","acculturation; depression; geriatric; Hispanic Americans; Mexican Americans","OBJECTIVE: HTo determine the association between acculturation, immigration, and prevalence of depression in older Mexican Americans. DESIGN: Cross-sectional analysis from a cohort study. SETTING: Urban and rural counties of the Central Valley of Northern California. PARTICIPANTS: One thousand seven hundred and eighty-nine Latinos recruited from a population-based sample (85% Mexican Americans) with a mean age of 70.6 (range 60–100; standard deviation (SD) = 7.13); 58.2% were women. MEASUREMENTS: Depressive symptoms were assessed with the Center for Epidemiologic Studies—Depression scale (CES-D). Acculturation was measured with the Acculturation Rating Scale for Mexican Americans—II. Psychosocial, behavioral, and medical histories were also obtained. RESULTS: The prevalence of depression (CES-D ≥ 16) was 25.4%. Women were at greater risk (32.0%) than men (16.3%; male/female odds ratio (OR) = 2.43, 95% confidence interval (CI) = 1.90–3.09). The prevalence of depression was higher among immigrants (30.4%, OR = 1.70, 95% CI = 1.36–2.13), bicultural participants (24.2%, OR = 1.66, 95% CI = 1.24–2.24), and less-acculturated participants (36.1%, OR = 2.95, 95% CI = 2.22–3.93) compared with U.S.-born (20.5%) and more-acculturated groups (16.1%). When adjustments for education, income, psychosocial, behavioral, and health-problem factors were made, the least-acculturated participants were at significantly higher risk of depression than highly acculturated Mexican Americans (OR = 1.56, 95% CI = 1.06–2.31). CONCLUSIONS: These findings are consistent with previously reported estimates of a higher prevalence of depression for older Mexican Americans than non-Hispanic Caucasians and African Americans and are the first to report the prevalence and risk of depression for older U.S.-born and immigrant Mexican Americans. The high prevalence of depression of the least acculturated group may be related to cultural barriers encountered by immigrants and less-acculturated older Mexican Americans and to poorer health status.","http://search.ebscohost.com.proxy-ub.rug.nl/login.aspx?direct=true&db=pbh&AN=5928486&site=ehost-live&scope=site"
"Acculturation Attitudes and Acculturative Stress of Central American Refugees.","Dona, G.; Berry, J.W.","International Journal of Psychology",="00207594",,="Feb94","29","1","57","14","5776785",,"Wiley-Blackwell","Article","CANADA; ACCULTURATION; REFUGEES; PSYCHOLOGICAL stress; ATTITUDE (Psychology)",,"Research on acculturation has revealed a variable relationship between acculturation and mental health, which is due to the presence of a number of moderating factors. Some of these factors, namely, modes of acculturation, acculturative experience with the host society, contact with the culture of origin, and individualistic values have been examined in order to understand better the relationship of these factors with acculturative stress. In the present research, Central American refugees (N = 101) who were resettled in Canada completed a questionnaire dealing with their attitudes, behaviours, values, and levels of acculturative stress. Results indicated that different factors are involved in the prediction of psychological and somatic aspects of acculturative stress, with contact with the culture of origin and modes of acculturation being the best predictors.","http://search.ebscohost.com.proxy-ub.rug.nl/login.aspx?direct=true&db=pbh&AN=5776785&site=ehost-live&scope=site"
"Acculturation Attitudes, Need for Cognitive Closure, and Adaptation of Immigrants.","Kosic, Ankica","Journal of Social Psychology",="00224545",,="Apr2002","142","2","179","23","6520170","10.1080/00224540209603894","Taylor & Francis Ltd","Article","ITALY; ACCULTURATION; ATTITUDE (Psychology); COGNITION; IMMIGRANTS","acculturation attitudes; acculturation strategies; Croatian immigrants to Italy; need for cognitive closure; Polish immigrants to Italy; psychological adaptation; sociological adaptation","ABSTRACT. The author validated Berry's model of acculturation (J. W. Berry, 1990a, 1990b, 1991; J. W. Berry, U. Kim, S. Power, M. Young, & M. Bujaki, 1989) and examined the relation between acculturation attitudes and sociocultural and psychological adaptation among Croatian and Polish immigrants to Italy, 2 groups whose cultures are not very different from the Italian culture. Moreover, the author investigated the relation between the need for cognitive closure (NCC; M. D. Webster & A. W. Kruglanski, 1994) and psychological and sociocultural adaptation. The participants completed a questionnaire including measures of sociocultural adaptation, psychological adaptation, social relationships, acculturation attitudes, and NCC. The results of a multivariate analysis of variance revealed main effects of acculturation strategies for both forms of adaptation and a main effect of NCC for psychological adaptation. The Croatian and Polish immigrants differed in the level of sociocultural adaptation but not in the level of psychological adaptation.","http://search.ebscohost.com.proxy-ub.rug.nl/login.aspx?direct=true&db=pbh&AN=6520170&site=ehost-live&scope=site"
"Acculturation models of immigrant Soviet adolescents in Israel.","Shamai S; Ilatov Z","Adolescence",="00018449",,="Fall2005","40","159","629","16","106089616",,"Libra Publishers Inc.","Journal Article",,,"This study probed acculturation in Israel of immigrant students from the former USSR from the perception of the host society and the students. The finding from a questionnaire distributed to Israeli-born and immigrant students indicated that most but not all of the Israel-born students applied an assimilatory model while the immigrants were split between those who accepted the Israeli students and those who resisted them. Thus, ethnic relation typologies and critical sociology of education concepts can explain only part of the immigrants' attitudes. It was found that both the host society and the immigrants have different attitudes toward the culture of the other, and thus use different acculturation strategies.","http://search.ebscohost.com.proxy-ub.rug.nl/login.aspx?direct=true&db=pbh&AN=106089616&site=ehost-live&scope=site"
