Article Title,Author,Journal Title,ISSN,ISBN,Publication Date,Volume,Issue,First Page,Page Count,Accession Number,DOI,Publisher,Doctype,Subjects,Keywords,Abstract,PLink
"Self-Assessments of Health by Korean Immigrant Women.","Yang, Kyeongra","Health Care for Women International",="07399332",,="Apr2007","28","4","329","10","24404021","10.1080/07399330601179836","Taylor & Francis Ltd","Article","UNITED States; EMIGRATION & immigration; MEDICAL care; WOMEN; KOREANS",,"The purpose of this study was twofold: to discover how Korean immigrant women perceived their health and to identify associations between social indicators and the health of Korean immigrant women. Participants in the study comprised a nonprobability sample of 137 Korean immigrant women living in the United States who submitted questionnaires about their health to the researcher by U.S. mail in 2004. Approximately 49% of the participants perceived their health as fair or poor. After age, income, education, marital status, and occupational status were controlled, the significant predictors of self-assessed health were involvement in exercise and length of residency in the United States. In future studies, the relationships between perception of health related to acculturation and self-rating health should be investigated.","http://search.ebscohost.com.proxy-ub.rug.nl/login.aspx?direct=true&db=pbh&AN=24404021&site=ehost-live&scope=site"
"Social capital, acculturation attitudes, and sociocultural adaptation of migrants from central Asian republics and South Korea in Russia.","Tatarko, Alexander; Berry, John W.; Choi, Keunwon","Asian Journal of Social Psychology",="13672223",,="Sep2020","23","3","302","11","144882879","10.1111/ajsp.12401","Wiley-Blackwell","Article","CENTRAL Asia; KAZAKHSTAN; SOUTH Korea; KYRGYZSTAN; TAJIKISTAN; TURKMENISTAN; UZBEKISTAN; RUSSIA; ACCULTURATION; ADAPTABILITY (Psychology); ETHNIC groups; IMMIGRANTS -- Psychology; QUESTIONNAIRES; SOCIAL capital","acculturation attitudes; bonding social capital; bridging social capital; migrants; sociocultural adaptation","This research examines the relationship of social capital with the acculturation attitudes and sociocultural adaptation of 122 migrants from Central Asian republics of the former Union of Soviet Socialist Republics (Uzbekistan, Tajikistan, Turkmenistan, Kyrgyzstan, and Kazakhstan) and 136 migrants from South Korea. The questionnaire included scales for assessing acculturation attitudes (integration, assimilation, and separation), individual social capital (bridging and bonding), and sociocultural adaptation. Using parallel mediation analysis, we found that acculturation attitudes for migrants from Central Asia are secondary to their social capital in relation to sociocultural adaptation. However, among migrants from South Korea, social capital is not linked to their acculturation attitudes, and in general, its role in sociocultural adaptation is lower as compared to the role of acculturation attitudes. As a whole, our research shows that although sociocultural adaptation for all ethnic groups is linked to acculturation attitudes and social capital, acculturation attitudes for certain ethnic groups can be dependent on social capital.","http://search.ebscohost.com.proxy-ub.rug.nl/login.aspx?direct=true&db=pbh&AN=144882879&site=ehost-live&scope=site"
"Sociodemographic and psychological variables related to sociocultural, acculturative orientation of North African immigrants in France.","Mokounkolo, René; Taillandier-Schmitt, Anne","South African Journal of Psychology",="00812463",,="Dec2008","38","4","689","10","36670219","10.1177/008124630803800408","Sage Publications, Ltd.","Article","SOCIODEMOGRAPHIC factors; PSYCHOLOGICAL factors; SOCIOCULTURAL factors; SOCIAL factors; ACCULTURATION; SOCIAL processes; MULTIVARIATE analysis; REGRESSION analysis","acculturative orientation; North African immigrants in France; sociocultural; sociodemographic and psychological predictors","We analysed two fields of the sociocultural, acculturative orientation of North African immigrants in France. The first is Immersion within the Society of Origin (ISO), which has two facets: ""Orientation towards Members of the Ingroup"" (OMI) and ""Orientation towards the culture of origin"" (OCO). The second, ""Immersion within the Host Society"" (IHS) also comprises two facets: ""Orientation towards People of French Origin"" (OPFO) and ""Orientation towards French Culture"" (OFC). The aim was to analyse the relationship between these four facets of sociocultural acculturative orientations and various socio-demographic and psychosocial variables. Two-hundred-and-ten North African immigrants in France answered a questionnaire adapted from Stephenson's Multigroup Acculturation Scale (SMAS). Stepwise multiple regression analyses show that OMI is linked to the country of origin and cultural identity, and OCO to satisfaction with life, family situation, sex and cultural identity. OPFO is linked to participation in club activities, and OFC to work/student activity and family situation. These results illustrate the relevance and value of studying immigrants' sociocultural, acculturative orientation on the basis of ISO vs. IHS models, and in the fields of their social relations and their relationship with the culture. They highlight the importance of looking at acculturation as a composite process, the various facets of which are related to different variables that can therefore be regarded as relevant indicators of immigrants' intercultural adaptation.","http://search.ebscohost.com.proxy-ub.rug.nl/login.aspx?direct=true&db=pbh&AN=36670219&site=ehost-live&scope=site"
"Story-based scales: development and validation of questionnaires to measure subjective health status and cultural adherence in British Bangladeshis with diabetes.","Greenhalgh T; Chowdhury M; Wood GW","Psychology, Health & Medicine",="13548506",,="Nov2006","11","4","432","17","106288054","10.1080/13548500500429379","Taylor & Francis Ltd","Journal Article",,,"Questionnaires that measure subjective health status are increasingly used in clinical trials. But scales based on the quantification of subjective traits ('rate your feelings on a scale of 1 to 5') and initially developed in western population samples may not be valid for use in minority ethnic groups, even if accurately translated. The measurement of cultural adaptation and assimilation in immigrant groups is important for health research but has well documented methodological challenges. The aim of this study was to develop valid and reliable questionnaires to measure subjective health status and cultural adherence in a minority ethnic group, using the story as the unit of inquiry. The design was a multi-phase study involving (a) narrative interview, (b) vignette construction, (c) questionnaire development, and (d) questionnaire validation in relation to two scales (well-being and cultural adherence) in British Bangladeshis with diabetes. Using data from in-depth narrative interviews (i.e., a non-directive research technique in which the participant is invited to 'tell me the story about your diabetes, starting with when you first noticed anything wrong', and the only prompts used are 'tell me more about that' or 'what happened next?'; Greenhalgh, Helman, & Chowdhury, 1998; Muller, 1999), we constructed culturally congruent vignettes to depict different subjective health states and behaviours. We refined these items in focus group interviews and validated the instruments on 98 Bangladeshi participants, randomly sampled from GP diabetes registers in inner London and interviewed by a Bangladeshi anthropologist. We used factor analysis to explore the underlying structure in the responses to questionnaire items, plus Cronbach alpha tests to measure internal consistency of scales. The questionnaires were acceptable and credible to Bangladeshi participants with diabetes. Ninety of 98 participants were able and willing to complete them with interviewer assistance. Following factor analysis, we produced two definitive instruments. The well-being scale was a single-factor model with four story-based items (measuring depression, anxiety, physical energy, and social activities), with a Cronbach's alpha of .92. The cultural adherence scale was a single-factor model with five items (measuring religious restrictions, ethnic practices, and social ties), with a Cronbach's alpha of .83. In conclusion, this study has produced two important outputs: (a) easy-to-administer, story-based questionnaires that measure well-being and cultural adherence, which are specific to British Bangladeshis with diabetes; (b) a general method for developing story-based instruments to quantify the subjective experience of illness and adherence to cultural norms, which potentially has applications beyond the study population.","http://search.ebscohost.com.proxy-ub.rug.nl/login.aspx?direct=true&db=pbh&AN=106288054&site=ehost-live&scope=site"
"Stress Is Associated with Unfavorable Patterns of Dietary Intake Among Female Chinese Immigrants.","Marilyn Tseng; Carolyn Fang","Annals of Behavioral Medicine",="08836612",,="Jun2011","41","3","324","9","60686957","10.1007/s12160-010-9259-4","Oxford University Press / USA","Article","PHILADELPHIA (Pa.); PENNSYLVANIA; IMMIGRANTS; PSYCHOLOGICAL stress; WEIGHT gain; EMIGRATION & immigration; CHRONIC disease risk factors; REGRESSION analysis","Acculturation; Asian; Dietary intake; Stress","Background: Chinese immigrants experience increased risk for weight gain and chronic disease after US migration. Whether psychosocial stress affects their eating behavior is unknown. Purpose: The purpose of this study is to examine psychosocial stress and dietary intake among 426 Chinese immigrant women in the Philadelphia region. Methods: Participants completed 4 days of dietary recalls and questionnaires assessing positive and negative life events in the past year and migration-related stressors. Results: In hierarchical linear regression models, positive life events were associated with higher energy intake ( β = 21.1, p = 0.04). Migration-related stress was associated with lower total gram ( β = −11.3, p < 0.0001) and overall grain ( β = −0.18, p = 0.03) intake and higher energy density ( β = 0.002, p = 0.04) and percent energy from fat ( β = 0.06, p = 0.05). Conclusions: Migration-related stress did not increase overall intake in terms of energy and total grams but selectively increased fat intake and energy density. Such dietary habits may have implications for future chronic disease risk in this immigrant population.","http://search.ebscohost.com.proxy-ub.rug.nl/login.aspx?direct=true&db=pbh&AN=60686957&site=ehost-live&scope=site"
"Stressors Related to Depression among Elderly Korean Immigrants.","Lee, Young-Me; Holm, Karyn","Issues in Mental Health Nursing",="01612840",,="Jan2012","33","1","52","7","70165444","10.3109/01612840.2011.618965","Taylor & Francis Ltd","Article","UNITED States; PSYCHOLOGICAL stress; MENTAL depression -- Psychological aspects; KOREANS -- United States; ACCULTURATION; CONCEPTUAL structures; CORRELATION (Statistics); IMMIGRANTS -- Psychology; LIFE change events; QUESTIONNAIRES; REGRESSION analysis; SCALE analysis (Psychology); SELF-evaluation; SURVEYS; TRANSLATIONS; SAMPLE size (Statistics); STATISTICAL power analysis; FAMILY relations; SOCIAL support; EFFECT sizes (Statistics); CROSS-sectional method; DATA analysis software; OLD age",,"While depression in the elderly is well documented, little is known about depression in specific groups of immigrant elderly. In this study, 160 elderly Korean immigrants completed measures of depression, stressful life events, acculturative stress, family relationships, social support, and demographic variables. Findings revealed that income, acculturative stress, and living place were significant predictors of depression. As income declined, depression increased; living with one's adult children was associated with less depression; depression increased in concert with acculturative stress. These findings suggest that maintaining family relationships may be a key factor in preventing and/or lessening depression in elderly Korean immigrants.","http://search.ebscohost.com.proxy-ub.rug.nl/login.aspx?direct=true&db=pbh&AN=70165444&site=ehost-live&scope=site"
"Substance Use and Cumulative Exposure to American Society: Findings From Both Sides of the US-Mexico Border Region.","Borges, Guilherme; Cherpitel, Cheryl J.; Orozco, Ricardo; Zemore, Sarah E.; Wallisch, Lynn; Medina-Mora, Maria-Elena; Breslau, Joshua","American Journal of Public Health",="00900036",,="Jan2016","106","1","119","9","111940508","10.2105/AJPH.2015.302871","American Public Health Association","Article","MEXICAN-American Border Region; UNITED States; MEXICO; DRUG abuse -- Social aspects; MEXICAN Americans; MEXICANS; METROPOLITAN areas -- United States; CITIES & towns; ALCOHOLISM risk factors; UNITED States -- Emigration & immigration; SUBSTANCE abuse; TWENTY-first century; SOCIAL history; SUBSTANCE abuse -- Psychological aspects; SUBSTANCE abuse -- Risk factors; ACCULTURATION; CONFIDENCE intervals; IMMIGRANTS -- Psychology; SOCIAL adjustment; CULTURAL values; CROSS-sectional method; DATA analysis software; DESCRIPTIVE statistics; ODDS ratio",,"Objectives. We investigated whether Mexican immigration to the United States exerts transnational effects on substance use in Mexico and the United States. Methods. We performed a cross-sectional survey of 2336 Mexican Americans and 2460 Mexicans in 3 Texas border metropolitan areas and their sister cities in Mexico (the US-Mexico Study on Alcohol and Related Conditions, 2011-2013). We collected prevalence and risk factors for alcohol and drug use; Diagnostic and Statistical Manual of Mental Disorders, Fourth Edition, alcohol-use disorders; and 2 symptoms (hazardous use and quit or control) of drug use disorder across a continuum of migration experiences in the Mexican and Mexican American populations. Results. Compared with Mexicans with no migrant experience, the adjusted odds ratios for this continuum of migration experiences ranged from 1.10 to 8.85 for 12-month drug use, 1.09 to 5.07 for 12-month alcohol use disorder, and 1.13 to 9.95 for 12-month drug-use disorder. Odds ratios increased with longer exposure to US society. These findings are consistent with those of 3 previous studies. Conclusions. People of Mexican origin have increased prevalence of substance use and disorders with cumulative exposure to US society.","http://search.ebscohost.com.proxy-ub.rug.nl/login.aspx?direct=true&db=pbh&AN=111940508&site=ehost-live&scope=site"
"The Acculturation of Iranian Immigrants in the United States and the Implications for Mental Health.","Ghaffarian, Shireen","Journal of Social Psychology",="00224545",,="Oct1998","138","5","645","10","1223022","10.1080/00224549809600419","Taylor & Francis Ltd","Article","UNITED States; ACCULTURATION; ANTHROPOLOGY; IRANIANS; IMMIGRANTS -- United States; MENTAL health",,"The process of acculturation among Iranian immigrants living in the United States was explored; specifically, the relationships between acculturation and mental health, age, gender, level of education, and length of residence in the United States were examined. Acculturation was measured via R. H. Mendoza's (1989) Cultural Life Style Inventory, which includes 3 components: cultural resistance, cultural incorporation, and cultural shift. A significant but slight relationship was found between acculturation and mental health: As cultural resistance increased, scores signifying better mental health decreased; as cultural incorporation and cultural shift increased, scores signifying better mental health increased. Also. Iranian men were found to have higher levels of cultural shift, lower levels of cultural resistance, and higher scores signifying better mental health than Iranian women.","http://search.ebscohost.com.proxy-ub.rug.nl/login.aspx?direct=true&db=pbh&AN=1223022&site=ehost-live&scope=site"
"The Association Between Acculturation Variables and Life Satisfaction Among Israeli Immigrants from Four English-Speaking Countries.","Zlotnick, Cheryl; Dryjanska, Laura; Suckerman, Suzanne","Journal of Happiness Studies",="13894978",,="Apr2020","21","4","1427","18","142867558","10.1007/s10902-019-00137-3","Springer Nature","Article","ISRAEL; ENGLISH-speaking countries; ACCULTURATION; IMMIGRANTS; SATISFACTION; LIFE expectancy","Acculturation; Diaspora; Expectations; Immigrants; Life satisfaction","This study's primary purpose was to examine the hypothesis that there would be a positive association between acculturation and life satisfaction for English-speaking diaspora immigrants to Israel regardless of country of origin (after adjusting for demographic characteristics including gender, age, years in the host country, reason for immigration and family support). Informed by Bornstein's Specificity Principle in Acculturation Science, acculturation was defined by levels of: language acquisition, having realised/met expectations, and self-identification with host country. Using a cross-sectional study design, a convenience sample of English-speaking participants was recruited through a link on a well-known English-language internet site targeting immigrants to Israel. Due to the diversity of respondents, only questionnaires completed by immigrants from the following four countries were included (n = 641): Canada (n = 40), South Africa (n = 66), the United Kingdom (n = 132) and the United States (n = 403). Life satisfaction only was linked to the acculturation variable of having a higher level of realised expectations for life after immigration and reporting good health, but not associated with the other acculturation variables of language acquisition or self-identification with host country. While having realised expectations was related to life satisfaction, the number of years in the host country and language acquisition was not. Having realistic expectations (related to greater life satisfaction) may be increased by providing prospective immigrants information on the new country's culture while they are still in the host country and planning their immigration.","http://search.ebscohost.com.proxy-ub.rug.nl/login.aspx?direct=true&db=pbh&AN=142867558&site=ehost-live&scope=site"
"The association between immigrant generational status, child maltreatment history and intimate partner violence (IPV): evidence from a nationally representative survey.","Kimber, Melissa; Henriksen, Christine; Davidov, Danielle; Goldstein, Abby; Pitre, Nicole; Tonmyr, Lil; Afifi, Tracie","Social Psychiatry & Psychiatric Epidemiology",="09337954",,="Jul2015","50","7","1135","10","103187638","10.1007/s00127-014-1002-1","Springer Nature","Article","IMMIGRANTS; INTIMATE partner violence; CHILD abuse; ACCULTURATION; LOGISTIC regression analysis; LONGITUDINAL method; GENERATION gap; HISTORY","Acculturation; Child maltreatment history; Gender differences; Immigrant status; Intimate partner violence","Purpose: The extent to which immigrant-specific factors influence the intergenerational transmission of family violence is unknown. The objectives of this paper are to examine the associations between immigrant generational status (IGS), child maltreatment (CM), intimate partner violence (IPV) and acculturation (i.e., the extent to which an individual adopts the values, language and attitudes of a new culture). Methods: The sample was drawn from wave two of the National Epidemiologic Survey on Alcohol and Related Conditions (NESARC; n = 34,653), a nationally representative survey of United States (US) residents aged 20 years and older. Logistic regression was used to estimate the associations between IGS, CM history, IPV, and acculturation. Results: Compared to 3rd generation (or later) respondents, 1st generation immigrants were less likely to report a history of sexual (AOR = 0.74, CI = 0.62, 0.90) and emotional abuse (AOR = 0.69, CI = 0.55, 0.87), but were more likely to report physical neglect (AOR = 1.30, CI = 1.11, 1.52). After adjusting for covariates, IGS was not associated with IPV among respondents with or without a CM history. Among those without a CM history, highly acculturated 1st generation immigrants (AOR = 1.07, CI = 1.01, 1.13) were more likely to report perpetrating IPV, with highly acculturated 3rd generation respondents having lower odds of reporting IPV perpetration (AOR = 0.93, CI = 0.88-1.00). Conclusion: IGS and acculturation are important factors in CM and IPV. Longitudinal studies are needed to clarify the influence of IGS, recency of immigration, acculturation and acculturative stress on the experiences and relationship between CM and IPV.","http://search.ebscohost.com.proxy-ub.rug.nl/login.aspx?direct=true&db=pbh&AN=103187638&site=ehost-live&scope=site"
"The association between religion and acculturation in Utah Mexican immigrants.","Steffen, Patrick; Merrill, Ray","Mental Health, Religion & Culture",="13674676",,="Jul2011","14","6","561","13","62667676","10.1080/13674676.2010.495747","Taylor & Francis Ltd","Article","MEXICO; UTAH; ACCULTURATION; ANALYSIS of variance; CATHOLIC Church; CHI-squared test; CHRISTIANITY; COMPUTER software; CULTURE; HISPANIC Americans; IMMIGRANTS; MULTIVARIATE analysis; SCALE analysis (Psychology); STATISTICS; WHITE people; DATA analysis; SOCIAL support; SOCIOECONOMIC factors; WELL-being; CROSS-sectional method","acculturation; immigrant; religiosity","The purpose of this study was to assess the influence of religious affiliation on acculturation among Mexican immigrants to Utah. In addition to demographic information, measures of acculturation, spirituality, social support, and perceived social status were administered to 336 participants. Latter-day Saints compared with Catholics and those of other religious affiliation tended to score significantly higher on Anglo cultural orientation, spirituality, and social support. Latter-day Saint acculturation may have been partly due to greater interaction with the US culture prior to coming to this country. Latter-day Saints also rated their subjective social status higher. Overall, religious affiliation was the strongest predictor of Anglo cultural orientation except for age upon entering the United States. In conclusion, religious affiliation predicts level of acculturation. Membership in an organisation that is dominant in the local community (e.g., the Latter-day Saint Church) contributes to the acculturation process, higher levels of spiritual well-being, and social support.","http://search.ebscohost.com.proxy-ub.rug.nl/login.aspx?direct=true&db=pbh&AN=62667676&site=ehost-live&scope=site"
"The association between social resources and depression among female migrants affected by domestic violence.","Teng, Pan; Hall, Brian J.; Li, Ling","European Journal of Psychotraumatology",="20008066",,="Jan2014","5",,"1","1","110338568","10.3402/ejpt.v5.26528","Taylor & Francis Ltd","Article",,"China; depression; Intimate partner violence; migration; social resources","BACKGROUND: Interpersonal violence (IPV) is associated with higher risk of depression. Female Chinese rural-to-urban migrants may experience greater depression following exposure to IPV due to lack of social support and integration within their receiving communities. The current study estimated the prevalence of IPV among rural-to-urban migrants in Guangzhou, China, and evaluated the moderating effects of social resources on migrant's depression symptoms. METHOD: We recruited 1,368 women (1,003 migrants and 365 local-born) of childbearing age from population and family planning centers in two districts using a quota sampling method matched to the 2012 population census. Chinese versions of the Conflict Tactics Scale 2 Short Form, Center for Epidemiological Studies Depression Scale and the Social Support Rating Scale measured IPV, depression, and social support. Social integration was measured with a locally derived scale. RESULTS: Migrants reported a similar prevalence for IPV (41.20%) to local women (39.20%). Bivariate comparisons demonstrated that migrants reported greater depression (11.8±8.9 vs. 10.0±8.8, t=-3.27, p<0.001) and less social support (22.2±5.1 vs. 27.1±5.5, t=14.84, p<0.001). Regression analysis indicated that the effect of violence on depression symptoms for migrant women was moderated by social integration. Women who experienced violence and had greater integration in their community reported less depression than women who experienced violence but reported less social integration. CONCLUSION: A high prevalence of IPV was reported in our sample. Social integration is a key risk factor for migrant mental health. Social services aimed to reduce IPV and integrate migrants in their new communities are needed.","http://search.ebscohost.com.proxy-ub.rug.nl/login.aspx?direct=true&db=pbh&AN=110338568&site=ehost-live&scope=site"
