"114","WebOfScience","Article",2016,"Stephens, CS","Acculturation contexts: Theorizing on the role of intercultural hierarchy in contemporary immigrants' acculturation strategies",1,NA,"Recent efforts to expand the theoretical framework of acculturation have drawn attention to a variety of pre-migration and reception contexts that affect how immigrants engage with the culture of their country of destination. Building on John W. Berry's seminal work, this article contributes to the development of acculturation theory by delineating the previously under-explored context of inter-cultural hierarchy. Employing a critical theory stance, the paper argues that immigrants' response to western cultural dominance and the rise of neoliberal imperatives can influence, along with the above mentioned contexts, their acculturative strategies. The paper proposes distinctions between types of assimilation, integration and separation strategies that have the potential to capture immigrant's risk of long-term psychosocial maladjustment in the country of destination.",1,NA,"MIGRATION LETTERS","Migration Letters","1741-8984","1741-8992",NA,NA,13,"3",333,"349",17,NA,81,5,5,1,4,"WOS:000446752900002","10.33182/ml.v13i3.287",NA,"TRANSNATIONAL PRESS LONDON","LONDON","12 RIDGEWAY GARDENS, LONDON, N6 5XR, ENGLAND","IDENTITY; NEOLIBERALISM; ASSIMILATION; ADAPTATION; MIGRATION; CONFLICT; MOBILITY; CULTURES; STYLES; LIFE","Immigration; acculturation; assimilation; integration; separation; intergroup hierarchy; cultural hegemony",NA,FALSE,FALSE,FALSE,"T-027",NA,0,"article not accessible",NA,NA,NA,NA
"115","WebOfScience","Article",2016,"Miller-Graff, LE","Frameworks for Childhood PTSD Treatment in Conflict-Affected Settings",0,"not acculturation","Over the past decade, the number and quality of studies on treating child posttraumatic stress disorder (PTSD) has grown exponentially. For the most part, however, these treatments have been validated in resource-rich settings and with individuals whose traumatic experiences are not ongoing. Many children living in conflict-affected settings experience symptoms of PTSD, and there are emerging data to support the effective generalization of evidence-based paradigms across contexts. Yet there remains a need for a deeper examination of the adaptation and implementation of evidence-based care in conflict-affected settings given the unique characteristics of providing care in these contexts. The aim of the current review is to provide an integrative social-ecological framework for the adaptation and implementation of child PTSD treatment in conflict-affected settings that synthesizes basic research and treatment evaluations. In summary, there is strong evidence to suggest the utility of evidence-based treatments for child PTSD in conflict-affected settings, but several recommendations regarding adaptation and implementation are evident. Because children in these contexts are likely to have ongoing exposure to violence and adversity, treatment adaptations should deeply consider how to deliver individual-level treatment for child PTSD with multisystemic supports. Identifying culturally relevant ways of delivering care within a multisystemic framework that maintains core effective mechanisms of treatment will necessarily involve emic investigations and should draw on the expertise of local professionals and paraprofessionals.",NA,NA,"PEACE AND CONFLICT-JOURNAL OF PEACE PSYCHOLOGY","Peace And Conflict-Journal Of Peace Psychology","1078-1919","1532-7949",NA,NA,22,"3",262,"271",10,NA,104,4,4,1,5,"WOS:000383593100009","10.1037/pac0000190",NA,"AMER PSYCHOLOGICAL ASSOC","WASHINGTON","750 FIRST ST NE, WASHINGTON, DC 20002-4242 USA","COGNITIVE-BEHAVIORAL THERAPY; MENTAL-HEALTH INTERVENTION; POSTTRAUMATIC STRESS SYMPTOMS; RANDOMIZED CONTROLLED-TRIAL; INTIMATE PARTNER VIOLENCE; PSYCHOSOCIAL TREATMENTS; CULTURAL-ADAPTATION; POLITICAL VIOLENCE; REFUGEE CHILDREN; OUTCOME RESEARCH","posttraumatic stress; violence; conflict; postconflict; children",NA,FALSE,FALSE,FALSE,NA,NA,NA,NA,NA,NA,NA,NA
"116","WebOfScience","Article",2016,"Torngren, SO; Irastorza, N; Song, MR","Toward building a conceptual framework on intermarriage",1,NA,"Increasing migration worldwide and the cultural diversity generated as a consequence of international migration has facilitated the unions of people from different countries, religions, races, and ethnicities. Such unions are often celebrated as a sign of integration; however, at the same time as they challenge people's idea of us and them, intermarriages in fact still remain controversial, and even to some extent, taboo in many societies. Research and theorizing on intermarriage is conducted predominantly in the English-speaking North American and British contexts. This special issue includes empirical studies from not only the English-speaking countries such as the U.S., Canada, and the UK, but also from Japan, Sweden, Belgium, France, and Spain and demonstrate the increasingly diverse directions taken in the study of intermarriage in regards to the patterns, experiences, and social implications of intermarriages. Moreover, the articles address the assumed link between intermarriage and integration.",0,"not theory","ETHNICITIES","Ethnicities","1468-7968","1741-2706",NA,NA,16,"4",497,"520",24,NA,109,13,13,5,40,"WOS:000380288400001","10.1177/1468796816638402",NA,"SAGE PUBLICATIONS LTD","LONDON","1 OLIVERS YARD, 55 CITY ROAD, LONDON EC1Y 1SP, ENGLAND","INTERETHNIC MARRIAGE; ECONOMIC ASSIMILATION; ETHNIC INTERMARRIAGE; IMMIGRATION; NETHERLANDS; CHILDREN; PERSPECTIVES; INTEGRATION; ATTITUDES; PATTERNS","Intermarriage; social acceptance; attitudes; integration; divorce; multiracial parenting",NA,FALSE,FALSE,FALSE,NA,NA,NA,NA,NA,NA,NA,NA
"117","WebOfScience","Article",2016,"Croucher, SM","Further development of integrated threat theory and intergroup contact: a reply to Aberson (2015)",0,"not migration","This essay furthers a dialogue about the theoretical and statistical merits of Croucher's [(2013). Integrated threat theory and acceptance of immigrant assimilation: An analysis of Muslim immigration in Western Europe. Communication Monographs, 80, 46-62] study exploring the relationships between threat from an immigrant group, belief that an immigrant wants to assimilate, and intergroup contact. Key points of divergence include assertions that (a) the relationships in the original piece are counter to previous literature/relationships, (b) the correlations presented are implausible, (c) the magnitude of the relationships is too strong, and (d) the manuscript has odd multiple regression coefficients. This rejoinder argues (a) more intergroup contact can lead to more threat, (b) the correlations are real, Aberson's [(2015). Strange results and implausible correlations in Croucher (2013). Communication Monographs] formula is invalid, and subsequent research has produced similar results, (c) the magnitude of the relationships and multiple regression coefficients is real, and (d) it is possible that statistical issues (such as sample characteristics and outliers) heightened the magnitude in this study.",NA,NA,"COMMUNICATION MONOGRAPHS","Communication Monographs","0363-7751","1479-5787",NA,NA,83,"2",269,"275",7,NA,24,5,5,1,16,"WOS:000375880800006","10.1080/03637751.2015.1119866",NA,"ROUTLEDGE JOURNALS, TAYLOR & FRANCIS LTD","ABINGDON","2-4 PARK SQUARE, MILTON PARK, ABINGDON OX14 4RN, OXON, ENGLAND","PREJUDICE; ATTITUDES","Integrated threat theory; intergroup contact; sampling; correlations",NA,FALSE,FALSE,FALSE,NA,NA,NA,NA,NA,NA,NA,NA
"118","WebOfScience","Article",2016,"Moreno-Galbis, E; Tritah, A","The effects of immigration in frictional labor markets: Theory and empirical evidence from EU countries",0,"not migrant","Immigrants are newcomers in a labor market. As a consequence, they lack host-country specific labor market knowledge and other country-specific and not directly productive valuable assets affecting their relative bargaining position with employers. We introduce this simple observation into a search and matching model of the labor market and show that immigrants increase the employment prospects of competing natives. To test the predictions of our model, we exploit yearly variations between 1998 and 2004 in the share of immigrants within occupations in 13 European countries. We identify the impact of immigrants on natives' employment rate using an instrumental variable strategy based on historical settlement patterns across host countries and occupations by origin country. We find that natives' employment rate increases in occupations and sectors receiving more immigrants. Moreover, we show that this effect varies depending on immigrants' characteristics and on host country labor market institutions which affect relative reservation wages. (C) 2015 Elsevier B.V. All rights reserved.",NA,NA,"EUROPEAN ECONOMIC REVIEW","European Economic Review","0014-2921","1873-572X",NA,NA,84,NA,76,"98",23,NA,60,14,14,0,34,"WOS:000375632400006","10.1016/j.euroecorev.2015.10.001",NA,"ELSEVIER SCIENCE BV","AMSTERDAM","PO BOX 211, 1000 AE AMSTERDAM, NETHERLANDS","LOW-SKILLED IMMIGRATION; WAGE DIFFERENTIALS; IMPACT; UNEMPLOYMENT; MIGRANTS; ECONOMY","Immigration; Reservation wage; Native employment; European labor markets; Assimilation",NA,FALSE,FALSE,FALSE,NA,NA,NA,NA,NA,NA,NA,NA
"119","WebOfScience","Article",2016,"Kelly, DR","Applying Acculturation Theory and Power Elite Theory on a Social Problem: Political Underrepresentation of the Hispanic Population in Texas",1,NA,"Legislative underrepresentation of the Hispanic population is a serious social problem in Texas. Hispanics in the Texas legislature comprise approximately 21% of the total legislative body, yet the Hispanic population is approximately 35% of the total population in Texas. Acculturation and Power Elite theories can enhance our understanding, providing a useful framework for explaining the underrepresentation phenomenon and identifying implications for further research. Acculturation refers to the internal processes of change that immigrants experience when they come into direct contact with members of the host culture, in this case Hispanics. Power elite theory is a concept of how the balance of power is maintained within the societal structure, in this case Texas. Together, these theories can account for underrepresentation and can help to form a strategy for Hispanics to overcome the underrepresentation phenomenon in Texas.",1,NA,"HISPANIC JOURNAL OF BEHAVIORAL SCIENCES","Hispanic Journal Of Behavioral Sciences","0739-9863","1552-6364",NA,NA,38,"2",155,"165",11,NA,15,4,4,1,8,"WOS:000374324700001","10.1177/0739986316638324",NA,"SAGE PUBLICATIONS INC","THOUSAND OAKS","2455 TELLER RD, THOUSAND OAKS, CA 91320 USA",NA,"Texas Hispanic population; Hispanic representation in Texas; voting rights in Texas; Hispanic voting rights; power elite; Mills; theory of balance; acculturation; Berry",NA,FALSE,FALSE,FALSE,"T-028",NA,1,NA,0,"not theory",NA,"application only"
"120","WebOfScience","Article",2016,"Fleischmann, F; Verkuyten, M","Dual Identity Among Immigrants: Comparing Different Conceptualizations, Their Measurements, and Implications",1,NA,"Objectives: This article aims to make a contribution to the literature by comparing 3 existing and often used conceptualizations and measurements of immigrants' dual identity: (a) high levels of identification with separate ethnic and national identities (Studies 1 and 2), (b) dual self-identification (Study 1), and (c) the strength of dual identification (Study 2). Method: Large-scale survey data are used in 2 studies, capturing 6 recent immigrant groups (Afghanis, Chinese, Iranians, Iraqis, Polish, and Somalis; Study 1, N = 5,877) and immigrants from Turkey (Study 2, N = 427) to The Netherlands. We investigate the associations between the different measures of dual identity as well as how each relates to indicators of intergroup relations (perceived subgroup respect and perceived discrimination) and immigrants' psychological outcomes (feeling at home in The Netherlands, happiness, affect toward the Dutch). Results: The findings show that dual self-identification differs most markedly from high identification on separate ethnic and national identities. The latter conceptualization largely overlaps with the strength of dual identification, both in terms of the classification of who is a dual identifier, as well as the associations with intergroup relations and immigrants' psychological outcomes. Conclusions: These findings help to clarify discrepant approaches to dual identity in the existing literature and provide guidelines for future research into dual identity among immigrants in Western societies. In particular, they suggest that a distinction between dual self-identification and measures of group identification is needed.",0,"not theory","CULTURAL DIVERSITY & ETHNIC MINORITY PSYCHOLOGY","Cultural Diversity & Ethnic Minority Psychology","1099-9809","1939-0106",NA,NA,22,"2",151,"165",15,NA,52,34,34,2,53,"WOS:000373107100001","10.1037/cdp0000058",26213892,"EDUCATIONAL PUBLISHING FOUNDATION-AMERICAN PSYCHOLOGICAL ASSOC","WASHINGTON","750 FIRST ST, NE, WASHINGTON, DC 20002-4242 USA","NATIONAL IDENTIFICATION; SUBGROUP RESPECT; DISCRIMINATION; ACCULTURATION; TURKISH; INTEGRATION; ATTITUDES; MINORITY; MIGRANTS; MODEL","dual identity; immigrant adaptation; intergroup relations",NA,FALSE,FALSE,FALSE,NA,NA,NA,NA,NA,NA,NA,NA
"121","WebOfScience","Article",2016,"Ward, C; Geeraert, N","Advancing acculturation theory and research: the acculturation process in its ecological context",1,NA,"Continued intercultural contact leads to challenges and changes. As part of this process, the acculturating individual deals with acculturative stressors whose negative effects on well-being can be buffered or exacerbated by coping reactions. A second component of the acculturation process involves the acquisition, maintenance, and change of cultural behaviors, values and identities associated with heritage and settlement cultures. Both acculturative stress and acculturative change unfold in an ecological context. Within the family, acculturation discrepancies between parents and children affect acculturation trajectories and outcomes. At the institutional level, the school and workplace exert significant influences on the acculturation of young people and working adults, respectively. At the societal level attitudes, policies and prejudice affect the acculturation experiences of sojourners and immigrants and influence their psychological and sociocultural adaptation.",1,NA,"CURRENT OPINION IN PSYCHOLOGY","Current Opinion In Psychology","2352-250X",NA,NA,NA,8,NA,98,"104",7,NA,71,116,116,4,79,"WOS:000375071000018","10.1016/j.copsyc.2015.09.021",29506811,"ELSEVIER SCIENCE BV","AMSTERDAM","PO BOX 211, 1000 AE AMSTERDAM, NETHERLANDS","CROSS-CULTURAL ADJUSTMENT; IMMIGRANT ADOLESCENTS; HISPANIC ADOLESCENTS; MENTAL-HEALTH; DEVELOPMENTAL TRAJECTORIES; PSYCHOLOGICAL ADAPTATION; UNITED-STATES; STRESS; FAMILIES; ORIENTATIONS",NA,NA,FALSE,FALSE,FALSE,"T-029",NA,1,NA,1,NA,"Ecological Acculturation Process Theory",NA
"122","WebOfScience","Article",2016,"Goldsmith, PR","Perpetuation theory and the racial segregation of young adults",0,"not ABCD","Previous research confirms a strong empirical association between the racial composition of young adults' residential areas and the racial compositions of the residential areas and schools of their youth. Perpetuation theory predicts that part of this association is causal. The present study uses data from the National Education Longitudinal Study (NELS) and the U.S. Censuses of 1990 and 2000 to test for this effect with regression models, propensity-score-weighted models with robustness tests, and regression models that look at long-distance movers. The findings suggest that the association declines rapidly as the distance moved increases, but it remains robust even at long distances. It is also stronger for African Americans and more assimilated Latinos than for whites and less assimilated Latinos. These findings suggests that to some extent, young white, African American, and Latino adults are residentially segregated from each other because they grew up that way. Policies that promote integrating youth residentially and/or desegregating schools may contribute to residential integration over time. (C) 2015 Elsevier Inc. All rights reserved.",NA,NA,"SOCIAL SCIENCE RESEARCH","Social Science Research","0049-089X","1096-0317",NA,NA,56,NA,1,"15",15,NA,66,7,7,1,17,"WOS:000370466500001","10.1016/j.ssresearch.2015.11.004",26857168,"ACADEMIC PRESS INC ELSEVIER SCIENCE","SAN DIEGO","525 B ST, STE 1900, SAN DIEGO, CA 92101-4495 USA","RESIDENTIAL SEGREGATION; CONCENTRATED DISADVANTAGE; METROPOLITAN AMERICA; SPATIAL ASSIMILATION; MOBILITY; WHITE; MIGRATION; BLACK; RACE; NEIGHBORHOODS","Segregation; Race; Ethnicity; Residential attainment; Neighborhoods; Schools",NA,FALSE,FALSE,FALSE,NA,NA,NA,NA,NA,NA,NA,NA
"123","WebOfScience","Article",2016,"Marinez-Lora, AM; Boustani, M; del Busto, CT; Leone, C","A Framework for Translating an Evidence-Based Intervention from English to Spanish",0,"not acculturation","This article describes the development of a framework for the Spanish language adaptation of an evidence-based intervention. A systematic literature search of language adaptation of interventions highlighted most published research focuses on the translation of assessment tools rather than interventions. In response, we developed the Participatory and Iterative Process Framework for Language Adaptation (PIPFLA), a descriptive step-by-step example of how to conduct the language adaptation of an intervention that is grounded in principles of good practice and facilitates transparency of the process. A bilingual team composed of project staff, translators, and two small panels of local community expertscomposed of Latino community-based clinicians and Latino immigrant parentsparticipated in the language adaptation of the intervention. The panels reviewed the translated materials and offered their independent emic perspectives; the intervention represented the etic perspective. Both perspectives informed and were integrated into the 11-step iterative process that comprises the PIPFLA framework.",NA,NA,"HISPANIC JOURNAL OF BEHAVIORAL SCIENCES","Hispanic Journal Of Behavioral Sciences","0739-9863","1552-6364",NA,NA,38,"1",117,"133",17,NA,36,4,4,0,7,"WOS:000369048700006","10.1177/0739986315612769",32694881,"SAGE PUBLICATIONS INC","THOUSAND OAKS","2455 TELLER RD, THOUSAND OAKS, CA 91320 USA","CHILD INTERACTION THERAPY; CULTURAL-ADAPTATION; LANGUAGE PROFICIENCY; HEALTH-CARE; LATINOS; DISORDERS; FAMILIES; EFFICACY; ACCEPTABILITY; DISPARITIES","language translation; Spanish language adaptation; back translation; community experts",NA,FALSE,FALSE,FALSE,NA,NA,NA,NA,NA,NA,NA,NA
"124","WebOfScience","Article",2016,"Chen, SXH; Lam, BP; Hui, BPH; Ng, JCK; Mak, WWS; Guan, YJ; Buchtel, EE; Tang, WCS; Lau, VCY","Conceptualizing Psychological Processes in Response to Globalization: Components, Antecedents, and Consequences of Global Orientations",0,"not migrant","The influences of globalization have permeated various aspects of life in contemporary society, from technical innovations, economic development, and lifestyles, to communication patterns. The present research proposed a construct termed global orientation to denote individual differences in the psychological processes of acculturating to the globalizing world. It encompasses multicultural acquisition as a proactive response and ethnic protection as a defensive response to globalization. Ten studies examined the applicability of global orientations among majority and minority groups, including immigrants and sojourners, in multicultural and relatively monocultural contexts, and across Eastern and Western cultures. Multicultural acquisition is positively correlated with both independent and interdependent self-construals, bilingual proficiency and usage, and dual cultural identifications. Multicultural acquisition is promotion-focused, while ethnic protection is prevention-focused and related to acculturative stress. Global orientations affect individuating and modest behavior over and above multicultural ideology, predict overlap with outgroups over and above political orientation, and predict psychological adaptation, sociocultural competence, tolerance, and attitudes toward ethnocultural groups over and above acculturation expectations/strategies. Global orientations also predict English and Chinese oral presentation performance in multilevel analyses and the frequency and pleasantness of intercultural contact in cross-lagged panel models. We discuss how the psychological study of global orientations contributes to theory and research on acculturation, cultural identity, and intergroup relations.",NA,NA,"JOURNAL OF PERSONALITY AND SOCIAL PSYCHOLOGY","Journal Of Personality And Social Psychology","0022-3514","1939-1315",NA,NA,110,"2",302,"331",30,NA,132,31,32,3,87,"WOS:000369151800007","10.1037/a0039647",26302436,"AMER PSYCHOLOGICAL ASSOC","WASHINGTON","750 FIRST ST NE, WASHINGTON, DC 20002-4242 USA","MULTICULTURAL PERSONALITY QUESTIONNAIRE; BICULTURAL IDENTITY INTEGRATION; INDIVIDUALISM-COLLECTIVISM; SOCIOCULTURAL ADJUSTMENT; IMPORTED CONSTRUCTS; SOCIAL-PSYCHOLOGY; REGULATORY FOCUS; 5-FACTOR MODEL; SELF; CULTURE","global orientations; globalization; multiculturalism; acculturation; cultural identity",NA,FALSE,FALSE,FALSE,NA,NA,NA,NA,NA,NA,NA,NA
"125","WebOfScience","Article",2016,"Waldinger, R; Catron, P","Modes of incorporation: a conceptual and empirical critique",1,NA,"Entering the debate over segmented assimilation, this paper seeks to refocus discussion on a core, but neglected claim: that inter-group disparities among immigrant offspring derive from differences in a contextual feature shared by immigrant and immigrant descendants: a nationality's mode of incorporation. The paper engages in both theoretical and empirical assessment. We critically examine the concept of mode of incorporation, demonstrating that its operational implications have not been correctly understood; consequently, the core hypothesis has never been appropriately tested. The second part of the paper implements those tests, making use of the Children of Immigrants Longitudinal Survey. We do so by using nationality as a proxy for mode of incorporation, systematically contrasting more advantaged against less advantaged nationalities. We show: (a) that tests systematically varying modes classified as more or less advantageous yield inconsistent outcomes; (b) that positive or negative modes of incorporation are associated with few long-lasting effects; (c) that differences in governmental reception are particularly unlikely to be associated with interethnic disparities; and (d) that compared to theoretically relevant nationalities, neither Mexicans, a nationality assigned to a negative mode of incorporation, nor pre-Mariel Cubans, a nationality assigned to positive mode of incorporation, prove distinctive.",0,"not theory","JOURNAL OF ETHNIC AND MIGRATION STUDIES","Journal Of Ethnic And Migration Studies","1369-183X","1469-9451",NA,NA,42,"1",23,"53",31,NA,40,17,17,0,11,"WOS:000367797400003","10.1080/1369183X.2015.1113742",NA,"ROUTLEDGE JOURNALS, TAYLOR & FRANCIS LTD","ABINGDON","2-4 PARK SQUARE, MILTON PARK, ABINGDON OX14 4RN, OXON, ENGLAND","SEGMENTED ASSIMILATION; EDUCATIONAL-ATTAINMENT; 2ND-GENERATION; CHILDREN; IMMIGRANTS; BILINGUALISM; DETERMINANTS; EXPERIENCE; LANGUAGE","Second generation; assimilation; segmented assimilation; modes of incorporation",NA,FALSE,FALSE,FALSE,NA,NA,NA,NA,NA,NA,NA,NA
"126","WebOfScience","Article",2016,"Kene, P; Brabeck, KM; Kelly, C; DiCicco, B","Suicidality among immigrants: Application of the interpersonal-psychological theory",0,"not acculturation","Immigrants constitute a significant percentage of the total population living in the United States; however, there is a paucity of research unique to suicidality among immigrants. The present article examines the applicability of the three variables of the interpersonal-psychological theory of suicidal behavior-acquired capability for suicide, sense of thwarted belongingness, and perceived burdensomeness-to conceptualize, assess, and treat suicidality among immigrants. Risk and protective factors and mechanisms are discussed in the context of 2 case studies and immigrant paradox. Clinical implications include assessment and treatment of immigrant-specific experiences. Obstacles to treatment and future research directions are presented.",NA,NA,"DEATH STUDIES","Death Studies","0748-1187","1091-7683",NA,NA,40,"6",373,"382",10,NA,75,3,3,0,15,"WOS:000380143700005","10.1080/07481187.2016.1155675",26890379,"ROUTLEDGE JOURNALS, TAYLOR & FRANCIS LTD","ABINGDON","2-4 PARK SQUARE, MILTON PARK, ABINGDON OX14 4RN, OXON, ENGLAND","NATIONAL EPIDEMIOLOGIC SURVEY; MENTAL-HEALTH; UNITED-STATES; ACCULTURATION; IDEATION; CHILDREN; MINORITY; TRAUMA; PAIN; DEPRESSION",NA,NA,FALSE,FALSE,FALSE,NA,NA,NA,NA,NA,NA,NA,NA
