"232","WebOfScience","Editorial Material",2002,"Reitz, JG","Host societies and the reception of immigrants: Research themes, emerging theories and methodological issues",0,"not migrant","Research on the reception and integration of immigrants now recognizes more explicitly the impact that characteristics of societies have as they play host to immigrants. This brief introduction to six papers - by Kasinitz, Mollenkopf and Waters; Boyd; Model and Lin; Borjas; Martin; and Castles - shows how they reflect a research emphasis on four interrelated features of host societies: 1) pre-existing ethnic and race relations, 2) labor markets and related institutions, 3) government policies and programs both for immigration and for broader institutional regulation, and 4) the changing nature of international boundaries, part of the process of globalization. Cultural dimensions permeate analyses of each of these four aspects. Together with others in a larger collection of 18 papers developing this theme (scheduled for publication as a book by the Centre for Comparative Immigration Studies, University of California at San Diego), the various analyses suggest elements useful in constructing a theory of immigrant reception and incorporation taking proper account of the impact of host societies.",NA,NA,"INTERNATIONAL MIGRATION REVIEW","International Migration Review","0197-9183",NA,NA,NA,36,"4",1005,"1019",15,NA,15,62,63,0,13,"WOS:000180492300001",NA,NA,"CENTER MIGRATION STUDIES","STATEN ISL","209 FLAGG PLACE, STATEN ISL, NY 10304 USA","ASSIMILATION",NA,NA,FALSE,FALSE,FALSE,NA,NA,NA,NA,NA,NA,NA,NA
"233","WebOfScience","Article",2002,"Jackson, JS","Conceptual and methodological linkages in cross-cultural groups and cross-national aging research",1,NA,"The international growth and the expected size of older populations require effective research strategies in life-course development and aging research across the globe. New conceptual frameworks and empirical research approaches are needed that are sensitive to similarities and differences in aging related processes across national, ethnic, and cultural group boundaries. These models and research approaches should contribute to distinguishing, aging-in-place-of-origin froth aging-out-of-place-of-origin, and the influences of. such factors as nationality, culturally affected behaviors, acculturation and intra-familial processes, on intra- and cross-country comparisons of aging related phenomena. Brief examples of how these new frameworks can be applied in addressing both theoretical and practical service issues are drawn from the aging research foci of the articles in this issue.",1,NA,"JOURNAL OF SOCIAL ISSUES","Journal Of Social Issues","0022-4537","1540-4560",NA,NA,58,"4",825,"835",11,NA,53,12,12,0,6,"WOS:000180161700013","10.1111/1540-4560.00292",NA,"WILEY","HOBOKEN","111 RIVER ST, HOBOKEN 07030-5774, NJ USA","REGIONAL DEMOGRAPHICS; MOVING CULTURES; FOREIGN-BORN; ACCULTURATION; IMMIGRATION; WOMEN; US",NA,NA,FALSE,FALSE,FALSE,"T-067",NA,1,NA,0,"not theory",NA,"focus on research approach"
"234","WebOfScience","Article",2002,"Kim, IJ; Zane, NWS; Hong, S","Protective factor against substance use among Asian American youth: A test of the peer cluster theory",0,"not acculturation","Few viable theoretical models of risk and protective factors for adolescent substance use have been empirically tested on diverse populations. The purpose of this study was twofold. First, the cross-cultural validity 4, Oetting and Beauvais' (1987) peer cluster theory was tested on a sample of Asian American youth. Second , the effect of youths' immigration experience on the relationship among the protective factors was examined. Results showed partial support for the validity of the peer cluster model for this sample. As hypothesized, the peer domain variable Was significantly related to substance use, while the family domain variable served as a Protective factor against substance use. However, the school domain variable did not have any direct or indirect effects on substance use. There were no significant differences in the path model when the sample was split according to youth immigrant status. Implications for substance use Prevention are discussed. (C) 2002 Wiley Periodicals,. Inc.",NA,NA,"JOURNAL OF COMMUNITY PSYCHOLOGY","Journal Of Community Psychology","0090-4392",NA,NA,NA,30,"5",565,"584",20,NA,85,30,31,0,7,"WOS:000177557200006","10.1002/jcop.10022",NA,"JOHN WILEY & SONS INC","HOBOKEN","111 RIVER ST, HOBOKEN, NJ 07030 USA","ADOLESCENT DRUG-USE; RISK-FACTORS; FAMILY-STRUCTURE; INDOCHINESE REFUGEES; ETHNIC-DIFFERENCES; ALCOHOL; ABUSE; ACCULTURATION; MODELS; PERSONALITY",NA,NA,FALSE,FALSE,FALSE,NA,NA,NA,NA,NA,NA,NA,NA
"235","WebOfScience","Article; Proceedings Paper",2002,"Barnett, C; Mencken, FC","Social disorganization theory and the contextual nature of crime in nonmetropolitan counties",0,"not migration","This research explores violent and property crime rates in nonmetropolitan Counties. It is argued that crime rates are lower in these counties because of higher levels of social integration. We test the hypothesis that predictors of crime front social disorganization theory exert different effects on violent and property crimes at different levels of population change in nonmetropolitan counties. We use a spatial lag regression model to predict the 1989-1991 average violent and property crime rates for these counties, taken front the Uniform Crime Reports (UCR). The results show that a factor-analyzed index of resource disadvantage (poverty rate, income inequality, unemployment, percent female-headed households) has different effects on both violent and property crime at different levels of population change in nonmetropolitan counties. Contrary to expectations, we find that resource disadvantage exerts a greater positive effect on both violent and property crimes in nonmetropolitan counties that lost population between 1980 and 1990. Implications for theory and research are discussed.",NA,NA,"RURAL SOCIOLOGY","Rural Sociology","0036-0112","1549-0831",NA,NA,67,"3",372,"393",22,NA,63,62,62,2,14,"WOS:000177780700003","10.1111/j.1549-0831.2002.tb00109.x",NA,"WILEY","HOBOKEN","111 RIVER ST, HOBOKEN 07030-5774, NJ USA","COMMUNITY ATTACHMENT; HOMICIDE RATES; UNITED-STATES; IMPACT; URBAN; DELINQUENCY; INEQUALITY; MIGRATION; POVERTY; GROWTH",NA,NA,FALSE,FALSE,FALSE,NA,NA,NA,NA,NA,NA,NA,NA
"236","WebOfScience","Review",2002,"Hyman, I; Guruge, S","A review of theory and health promotion strategies for new immigrant women",0,"not acculturation","Background: There has been little empirical research on the best ways to influence women's health behaviour, particularly among women who are recent immigrants to Canada. Methods: This paper presents information from a literature review conducted for the Ontario Women's Health Council on effective theoretical models and health promotion strategies for women. Findings: Health promotion activities for all women should address theoretical variables as well as the broader determinants of women's health. New immigrant women represent a diverse group who often face multiple cultural, linguistic and systemic barriers to adopting and maintaining healthy behaviour. Interpretation: Many theoretical constructs of potential importance to recent immigrant women have not been adequately researched. More research is also needed on the relevancy and the applicability of commonly used health promotion approaches for this group.",NA,NA,"CANADIAN JOURNAL OF PUBLIC HEALTH-REVUE CANADIENNE DE SANTE PUBLIQUE","Canadian Journal Of Public Health-Revue Canadienne De Sante Publique","0008-4263","1920-7476",NA,NA,93,"3",183,"187",5,NA,44,25,26,0,4,"WOS:000175913600007","10.1007/BF03404997",12050984,"SPRINGER INTERNATIONAL PUBLISHING AG","CHAM","GEWERBESTRASSE 11, CHAM, CH-6330, SWITZERLAND","AMERICAN WOMEN; UNITED-STATES; PAP SMEAR; ACCULTURATION; HISPANICS; SMOKING; CANCER",NA,NA,FALSE,FALSE,FALSE,NA,NA,NA,NA,NA,NA,NA,NA
"237","WebOfScience","Article",2002,"Constant, A; Massey, DS","Return migration by German guestworkers: Neoclassical versus new economic theories",0,"not migration","Neoclassical economics and the new economics of labour migration posit very different motivations for international migration. The former assumes that people move abroad permanently to maximize lifetime earnings whereas the latter assumes they leave temporarily to overcome market deficiencies at home. As a result, the two models yield very different conceptualizations of return migration. We draw upon each theoretical model to derive predictions about how different variables are likely to influence the probability of return migration. We use data from the German Socio-economic Panel to test specific hypotheses derived from each model. Finding some support for both perspectives, we suggest that migrants may be heterogeneous with respect to their migratory motivations. If so, then parameters associated with the determinants of return migration in any population of international migration will reflect a blending of parameters associated with two distinct economic rationales. Equations estimated separately for remitting and non-remitting migrants lend support to this interpretation, meaning there may not be one unitary process of return migration, but several.",NA,NA,"INTERNATIONAL MIGRATION","International Migration","0020-7985",NA,NA,NA,40,"4",5,"38",34,NA,31,197,208,3,34,"WOS:000178472300002","10.1111/1468-2435.00204",NA,"INT ORGANIZATION MIGRATION","GENEVA 19","PO BOX 71, CH-1211 GENEVA 19, SWITZERLAND","COHORT QUALITY; UNITED-STATES; IMMIGRANTS; EMIGRATION; ASSIMILATION; EARNINGS",NA,NA,FALSE,FALSE,FALSE,NA,NA,NA,NA,NA,NA,NA,"re-migration"
"238","WebOfScience","Article",2001,"Liou, D; Contento, IR","Usefulness of psychosocial theory variables in explaining fat-related dietary behavior in Chinese Americans: Association with degree of acculturation",0,"not theory","Objective: To determine the usefulness of variables from psychosocial models of health behavior in explaining fat-related dietary behavior among a sample of Chinese Americans. Design: A survey questionnaire was administered to a convenience sample of Chinese Americans and analyzed for descriptive statistics and relationships among variables. Subjects/Settings: Participants were 600 healthy individuals, ranging from 21 to 70 years of age, living in New York City. Variables Measured: Demographic factors, degree of acculturation, food preferences, and 13 social psychological scales derived from the Theory of Planned Behavior, the Healthy Belief Model, and Social Cognitive Theory. Dependent measures assessed were intention to reduce dietary fat and behaviors related to the selection of reduced-fat diets. Statistical Analyses: Descriptive statistics, Pearsons' correlation coefficients, t-tests, one-way analysis of variance, and multiple regression analyses were used. Results: Attitude, overall health concern, and self-efficacy accounted for 58% of the variance in behavioral intention for the entire sample. Attitude, perceived barriers, and self-efficacy accounted for 19% of the variance in the prediction of dietary fat reduction behaviors. In general, a gradient was seen in the increased predictiveness of cacti regression model by degree of acculturation of the immigrants to American culture: predictiveness (R2) for behavior ranged from 15% for the least to 34%, for the most acculturated. Acculturation was significantly related to declines in the influence of habit and of social norms. These effects were not seen by length of residency. Implications: Nutrition educators should assess the degree of acculturation of groups with whom they work and recognize that the degree of acculturation impacts the relative importance of various psychosocial variables in fat reduction behaviors.",NA,NA,"JOURNAL OF NUTRITION EDUCATION","Journal Of Nutrition Education","0022-3182",NA,NA,NA,33,"6",322,"331",10,NA,41,41,41,0,9,"WOS:000172801400003","10.1016/S1499-4046(06)60354-0",12031170,"B C DECKER INC","HAMILTON","20 HUGHSON ST SOUTH, PO BOX 620, L C D 1, HAMILTON, ONTARIO L8N 3K7, CANADA","SELF-EFFICACY; FOOD-CONSUMPTION; NUTRITION; ATTITUDES; POPULATIONS; KNOWLEDGE; MODEL; WOMEN; MEN","Chinese Americans; psychosocial theory; dietary fat",NA,FALSE,FALSE,FALSE,NA,NA,NA,NA,NA,NA,NA,NA
"239","WebOfScience","Article",2001,"Hattam, VC","Whiteness: Theorizing race, eliding ethnicity (race and labor in America)",0,"not migration","Arnesen too quickly dismisses recent whiteness scholarship without first taking stock of the ways in which this work has transformed the research agenda in labor history and beyond. Whiteness scholars have made three important contributions: theorizing class as identification, historicizing race, and centering the nation. After briefly elaborating on each of these contributions, I argue that this body of new research has been limited both by its inattention to the specificity of ethnic identification and by its acceptance of the standard assimilation narratives of American immigration history. Addressing these limitations points the way to some fruitful lines of new research.",NA,NA,"INTERNATIONAL LABOR AND WORKING-CLASS HISTORY","International Labor And Working-Class History","0147-5479","1471-6445",NA,NA,NA,"60",61,"68",8,NA,46,3,3,0,1,"WOS:000172154600006",NA,NA,"CAMBRIDGE UNIV PRESS","NEW YORK","32 AVENUE OF THE AMERICAS, NEW YORK, NY 10013-2473 USA","IMMIGRATION",NA,NA,FALSE,FALSE,FALSE,NA,NA,NA,NA,NA,NA,NA,NA
"240","WebOfScience","Article; Proceedings Paper",2001,"Congdon, JD; Dunham, AE; Hopkins, WA; Rowe, CL; Hinton, TG","Resource allocation-based life histories: A conceptual basis for studies of ecological toxicology",0,"not migration","Whereas ecological assessments of contaminants are concerned with populations and higher levels of organization, most mechanistic work in toxicology is directed at effects on individuals and their parts. We propose that studies based on individuals can be useful in ecological analysis of polluted systems when based on the concepts of resource allocation-based life history analysis. At the heart of the resource allocation approach is the concept of operative environments of individuals (i.e., environmental factors influencing birth, death, or migration). Contaminants can have strong influences on operative environments, modifying resource allocation strategies that reflect changes in energy assimilation and demands. By examining contaminant-induced responses of individuals from the perspective of changing operative environments, individual-based changes and population dynamics can be addressed in an ecologically rigorous manner.",NA,NA,"ENVIRONMENTAL TOXICOLOGY AND CHEMISTRY","Environmental Toxicology And Chemistry","0730-7268","1552-8618",NA,NA,20,"8",1698,"1703",6,NA,57,96,96,0,32,"WOS:000170022800011","10.1002/etc.5620200811",11491551,"WILEY","HOBOKEN","111 RIVER ST, HOBOKEN 07030-5774, NJ USA","BODY ELECTRICAL-CONDUCTIVITY; STANDARD METABOLIC-RATE; SWIMMING PERFORMANCE; REPRODUCTIVE EFFORT; NATURAL-SELECTION; ENERGETICS; EXPOSURE; STRESS; COSTS; EVOLUTION","resource allocation; life history; energy budget; metabolism",NA,FALSE,FALSE,FALSE,NA,NA,NA,NA,NA,NA,NA,NA
"241","WebOfScience","Article",2001,"Yoshihama, M","Immigrants-in-context framework: understanding the interactive influence of socio-cultural contexts",1,NA,"Research on immigrants is associated with many methodological challenges. Drawing from a recent study of domestic violence among four generations of Japanese American women, this paper elucidates approaches to address methodological challenges in research with immigrant populations. Preliminary studies in both the respondents' country of origin and the United States assisted the identification of socio-culturally rooted manifestations of partners' violence; the development of an expanded, socio-culturally relevant measure of domestic violence; and the examination of within-group variations in the perception about and coping responses to partners' violence. Based on the findings of this and other studies of immigrants, this paper proposes the Immigrants-in-Context framework to conceptualize immigrants' experiences in the context of interactive and transgenerational influences of the socio-cultural factors in the country of origin and those in the country of immigration/residence. This framework may be applicable to other research efforts aimed at understanding social issues affecting immigrant communities. (C) 2001 Elsevier Science Ltd. All rights reserved.",0,"not theory","EVALUATION AND PROGRAM PLANNING","Evaluation And Program Planning","0149-7189","1873-7870",NA,NA,24,"3",307,"318",12,NA,52,19,19,0,3,"WOS:000169719100008","10.1016/S0149-7189(01)00021-0",NA,"PERGAMON-ELSEVIER SCIENCE LTD","OXFORD","THE BOULEVARD, LANGFORD LANE, KIDLINGTON, OXFORD OX5 1GB, ENGLAND","ACCULTURATION; AMERICAN; WOMEN; HEALTH; PREVALENCE; MOBILITY; LATINA","domestic violence; abuse; immigrants; socio-cultural context; culture; Japanese Americans",NA,FALSE,FALSE,FALSE,NA,NA,NA,NA,NA,NA,NA,NA
"242","WebOfScience","Article",2001,"Kivisto, P","Theorizing transnational immigration: a critical review of current efforts",1,NA,"During the past decade, transnationalism has entered the lexicon of migration scholars. As with other terms used in the study of immigration and ethnicity, this concept suffers from ambiguity as a result of competing definitions that fail to specify the temporal and spatial parameters of the term and to adequately locate it vis-a-vis older concepts such as assimilation and cultural pluralism. This article offers a review and critique of the ways the term has come to be employed at the hands of key spokespersons that have articulated the most sustained theoretical rationales to date for transnationalism as a conceptual construct to account for new immigrant identities and communities. The conclusion of the essay offers in schematic form an alternative assessment of transnationalism that locates it as one potential subset of assimilation theory, rather than as an alternative to it.",1,NA,"ETHNIC AND RACIAL STUDIES","Ethnic And Racial Studies","0141-9870",NA,NA,NA,24,"4",549,"577",29,NA,80,300,309,0,75,"WOS:000169793800002","10.1080/01419870120049789",NA,"ROUTLEDGE","HANTS","CUSTOMER SERVICES DEPT, RANKINE RD, BASINGSTOKE, HANTS RG24 8PR, ENGLAND","INTERNATIONAL MIGRATION; ASSIMILATION; CITIZENSHIP; ETHNICITY; FUTURE; MODEL","transnational immigration; nation-state; assimilation; pluralism; citizenship; globalization",NA,FALSE,FALSE,FALSE,"T-068",NA,1,NA,1,NA,"Transnational Social Spaces added from review",NA
"243","WebOfScience","Article",2001,"Nagasawa, R; Qian, ZC; Wong, P","Theory of segmented assimilation and the adoption of marijuana use and delinquent behavior by Asian Pacific youth",0,"not theory","This article examines the adoption of behaviors of the teen drug and delinquent subcultures among Asian Pacific youth within the framework of the theory of segmented assimilation. Alejandro Portes and Min Zhou's theory offers a new perspective to the question: Under what conditions are youth susceptible to marijuana use and delinquent behavior? In contrast to Milton Gordon's classic one-path theory, segmented assimilation theory looks to the immigrant culture and social capital (e.g., social solidarity) as critical factors in the assimilation process. The theory suggests several different types of adaptation by immigrant youth and Asian youth born in the United States. The data from the Asian Student Drug Survey were used to analyze the patterns of marijuana use and delinquent behavior among Japanese, Chinese, Filipino, Korean, Southeast Asian, Asian Indian, and Pacific Islander youth, controlling for human capital and social capital, as well as other relevant factors. Logistic regression analysis was used to determine the factors that affect the odds of marijuana use and delinquent behavior for the seven ethnic groups in this study. The likelihood of marijuana use differed significantly among the ethnic groups. For example, Pacific Islander and Filipino youth were much more likely than Japanese youth to use marijuana. Korean, Southeast Asian, and Asian Indian youth did not differ significantly from the Japanese youth in marijuana use. Like the model that predicted marijuana use, the Chinese youth were least likely to engage in delinquent behavior, while Filipino and Pacific Islander youth were most likely. Segmented assimilation theory points to the importance of the human and social capital that serve to insulate youth from the influence of the teen drug and delinquent cultures.",NA,NA,"SOCIOLOGICAL QUARTERLY","Sociological Quarterly","0038-0253",NA,NA,NA,42,"3",351,"372",22,NA,45,52,52,0,8,"WOS:000171680800003","10.1111/j.1533-8525.2001.tb02405.x",NA,"UNIV CALIF PRESS","BERKELEY","C/O JOURNALS DIVISION, 2000 CENTER ST, STE 303, BERKELEY, CA 94704-1223 USA","UNITED-STATES; DRINKING PATTERNS; ACCULTURATION; AMERICANS; ALCOHOL; VIETNAMESE; JAPANESE; MINORITY; RACE",NA,NA,FALSE,FALSE,FALSE,NA,NA,NA,NA,NA,NA,NA,NA
"244","WebOfScience","Article; Proceedings Paper",1999,"Smith, LR","Intercultural network theory: A cross-paradigmatic approach to acculturation",1,NA,"The field of intercultural relations has devoted considerable attention to the idea of separate research paradigms. The distinctions between perspectives such as qualitative-quantitative, subjective-objective, functional-interpretive, etc., dominate theoretical and methodological writings. These distinctions ave important for outlining the parameters of various research programs, however, many interesting issues in the cultural adjustment process deny the dichotomization of experience and require an approach that addresses a reality that is both reliable and present while at the same lime situated and emergent. Recently our focus in the field has been trained on how we might bridge those distinct paradigms with a plausible intercultural theory. In the first portion of this article I outline three common research paradigms employed in intercultural relations. The social network perspective is then offered as a cross-paradigmatic research and theorizing approach. The conceptual history and relevant properties of social networks for intercultural research are described as part of the foundation for a theory of intercultural social networks that allows us to address the relational quality of intercultural interaction while acknowledging the stability of structural phenomena. I then propose seven assumptions and seven propositions comprising the beginning of a dynamic theory of intercultural social networks. Based upon the propositions put forward, future research avenues are suggested, I conclude that a socio-structural approach to acculturation, and the study of intercultural relations ill general, is uniquely suited to capture and reconcile situated, emergent phenomena with reliable, present phenomena and increase our understanding of inter-cultural relations. (C) 1999 Elsevier Science Ltd. All rights reserved.",1,NA,"INTERNATIONAL JOURNAL OF INTERCULTURAL RELATIONS","International Journal Of Intercultural Relations","0147-1767","1873-7552",NA,NA,23,"4",629,"658",30,NA,100,15,15,0,9,"WOS:000082831800006","10.1016/S0147-1767(99)00013-9",NA,"PERGAMON-ELSEVIER SCIENCE LTD","OXFORD","THE BOULEVARD, LANGFORD LANE, KIDLINGTON, OXFORD OX5 1GB, ENGLAND","SOCIAL SUPPORT; CHINESE STUDENTS; UNITED-STATES; ADJUSTMENT; JAPAN; IMMIGRANTS",NA,NA,FALSE,FALSE,FALSE,"T-069",NA,1,NA,1,NA,"Intercultural Network Theory",NA
"245","WebOfScience","Article",1999,"Gale, N","Residence, social mobility and practice theory: the case of Sephardic Jews of Sydney",1,NA,"This paper focuses on residential mobility of an ethnic group within a complex linkage between religion, ethnicity and race. It places the triangular transactional relationship between white Australian gentiles, white Ashkenazic Jews and Asian (non-white) Sephardic Jews together with the strategy of residential movement, within the conceptual framework of Bourdieu's Practice Theory. in doing so, the study highlights the unique situation of Sephardim as a fragmented minority within a larger minority (the Ashkenazic community), and within a multicultural ocean of migrants dominated by a white Angio-Celtic culture based on racial criteria. Supported by several case studies, the study shows how the practice of residential movement has changed the system, making it less rigid and more open to migrants, and how the gradually changing system has influenced the lives of the doers (Sephardic Jews). Specifically, the practice of residential movement has gradually increased diversity in the make-up of Australian residential structure. At the same time, this major social change has been accompanied by change in the make-up of the Sephardic community, involving reconstructed kinship relations and ethnic identities, particularly Sephardic acculturation into the Australianised Ashkenazi subsystem.",0,"not migrant","JOURNAL OF SOCIOLOGY","Journal Of Sociology","0004-8690",NA,NA,NA,35,"2",149,"168",20,NA,80,1,1,0,2,"WOS:000082785600002","10.1177/144078339903500202",NA,"ADDISON WESLEY LONGMAN","SOUTH MELBOURNE","95 CONVENTRY ST, PO BOX 1024, SOUTH MELBOURNE, VIC 3205, AUSTRALIA",NA,NA,NA,FALSE,FALSE,FALSE,NA,NA,NA,NA,NA,NA,NA,NA
