"357","PsychInfo","Journal Article",2006,"Madison, Greg","Existential Migration: Conceptualising Out of the Experiential Depths of Choosing to Leave 'Home'.",1,NA,"The following is a preliminary discussion of research that unexpectedly gave rise to the new concept of 'existential migration'. Phenomenological interviews with voluntary migrants, individuals who choose to leave their homeland to become foreigners in a new culture, reveal consistently deep themes and motivations which could convincingly be labelled 'existential'. Rather than migrating in search of employment, career advancement, or overall improved economic conditions, these voluntary migrants are seeking greater possibilities for self-actualising, exploring foreign cultures in order to assess their own identity, and ultimately grappling with issues of home and belonging in the world generally. The article offers a sketch of this phenomenon with reference to Martin Heidegger's ontology, thereby indicating alternative understandings of 'home', 'not-being-at-home', 'belonging', which take into account the narratives of these migratory experiences. An example of the conceptual ramifications of this new understanding of voluntary migration is found in the definition of 'home as interaction' rather than the usual 'home as place'. The article offers a cautionary note regarding the potentially profound and mostly ignored psychological consequences of the contemporary push to increasing globalisation. As a summary article, what follows will potentially raise more questions than answers for the reader; further articles will be forthcoming and feedback is welcome. (PsycINFO Database Record (c) 2017 APA, all rights reserved)",1,NA,"Existential Analysis","Existential Analysis","20440413",NA,NA,20060701,17,"2",238,NA,23,NA,NA,NA,NA,NA,NA,"2006-09557-003",NA,NA,"Society for Existential Analysis",NA,NA,"Existentialism; Human Migration; Immigration; Philosophies; Psychodynamics; Acculturation; Anthropology; Adulthood (18 yrs & older); Young Adulthood (18-29 yrs); Thirties (30-39 yrs); Middle Age (40-64 yrs); Male; Female",NA,"http://search.ebscohost.com.proxy-ub.rug.nl/login.aspx?direct=true&db=psyh&AN=2006-09557-003&site=ehost-live&scope=site",FALSE,FALSE,FALSE,"T-100",NA,1,NA,1,NA,"Existential Migration Concept",NA
"358","PsychInfo","Journal Article",2008,"Cheung-Blunden, Violet L.; Juang, Linda P.","Expanding acculturation theory: Are acculturation models and the adaptiveness of acculturation strategies generalizable in a colonial context?",NA,NA,"Most acculturation research has been conducted in immigrant settings. The present study examined the generalizability of acculturation models and the adaptiveness of acculturation strategies in another bicultural environment--a colonial setting. The sample included 138 girls (M = 13.8 years) and their parents from Hong Kong, a former British colony. Results verified that both Chinese and western acculturation occurred on individual psychological levels and that the bidimensional model was a suitable acculturation framework. Using hierarchical multiple regression, results suggested that acculturation towards Chinese (majority) culture was related to better adaptation in terms of higher academic achievement and positive family dynamics (parental nurturance and closer family relationships). Acculturation towards western (minority) culture was related to poorer adaptation in terms of engaging in greater misconduct and negative family interactions (larger intergenerational value discrepancies and family conflicts). Thus, acculturation towards the majority culture held adaptive implications, whereas acculturation towards the minority culture held maladaptive implications. Consideration of the bicultural composition (e.g., status, prestige, strength of cultural networks of each culture) should be incorporated into acculturation theory to better understand adjustment implications across a wide range of contexts. (PsycINFO Database Record (c) 2016 APA, all rights reserved)",NA,NA,"International Journal of Behavioral Development",NA,"1650254",NA,NA,20080101,32,"1",21,NA,13,NA,NA,NA,NA,NA,NA,"2007-19998-003","10.1177/0165025407084048",NA,"Sage Publications",NA,NA,"Acculturation; Adjustment; Chinese Cultural Groups; Immigration; Multiculturalism; Models; Strategies; Childhood (birth-12 yrs); School Age (6-12 yrs); Adolescence (13-17 yrs); Adulthood (18 yrs & older); Female",NA,"http://search.ebscohost.com.proxy-ub.rug.nl/login.aspx?direct=true&db=psyh&AN=2007-19998-003&site=ehost-live&scope=site",TRUE,TRUE,TRUE,NA,NA,NA,NA,NA,NA,NA,NA
"359","PsychInfo","Journal Article",2013,"Huot, Suzanne; Rudman, Debbie Laliberte; Dodson, Belinda; Magalhes, Lilian","Expanding policy-based conceptualizations of 'successful integration': Negotiating integration through occupation following international migration.",1,NA,"The immigration of French-speakers to Canada and their successful integration into Francophone minority communities has become a priority for the country's federal government. A critical ethnography served to challenge assumptions regarding successful integration embedded within government documents and to raise awareness of the challenges faced by French-speaking immigrants from visible minority groups residing within London, Ontario, Canada. A theoretical framework applying Goffman's concept of performance and Bourdieu's concepts of field, habitus, and capital guided the stud/. Eight migrants participated in up to five sessions including narrative and in-depth interviews, Occupational Mapping, and participation in occupations. Findings highlight that integration involves a process of 'starting over,' which entails becoming aware of differences in fields and habitus within and between home and host societies, learning 'how things work' in the host community, and negotiating performances in social interactions. This negotiation, enacted primarily through occupation, is influenced by differential access to forms of capital. It is further related to ways immigrants' intersecting identity markers are constructed within particular places and embedded in broader social systems and structures. These findings challenge the linear and individualized process of integration identified within government documents, and the narrow focus on economic productivity as the occupation-based marker of integration. (PsycINFO Database Record (c) 2016 APA, all rights reserved)",1,NA,"Journal of Occupational Science","Journal Of Occupational Science","14427591",NA,NA,20130401,20,"1",6,NA,17,NA,NA,NA,NA,NA,NA,"2013-10831-001","10.1080/14427591.2012.717497",NA,"Taylor & Francis",NA,NA,"Immigration; Policy Making; Social Integration; Social Interaction; Concept Formation; Minority Groups; Occupations; Adulthood (18 yrs & older); Male; Female",NA,"http://search.ebscohost.com.proxy-ub.rug.nl/login.aspx?direct=true&db=psyh&AN=2013-10831-001&site=ehost-live&scope=site",FALSE,FALSE,FALSE,"T-101",NA,1,NA,1,NA,"Negotiating Integration through Occupation Theory",NA
"360","PsychInfo","Journal Article",2014,"de Figueiredo, John M.","Explaining the immigration advantage and the biculturalism paradox: An application of the theory of demoralization.",NA,NA,"Background: Recent immigrants have better mental health than the natives (immigration advantage). Biculturals have better mental health than the monoculturals (biculturalism paradox). Material: Mexican immigrants have lower rates of psychopathology than the US population. This is less true for Cubans and not true for Puerto Ricans. The advantage also occurs in other groups. Biculturals have better mental health and endorse both cultures. Discussion: The theory of demoralization predicts that borrowing values from both cultures and applying them judiciously are more conducive to mental health than indiscriminately subscribing to either culture. Conclusion: The findings are consistent with the theory of demoralization. (PsycINFO Database Record (c) 2016 APA, all rights reserved)",NA,NA,"International Journal of Social Psychiatry",NA,"207640",NA,NA,20140301,60,"2",175,NA,3,NA,NA,NA,NA,NA,NA,"2014-06793-010","10.1177/0020764013477018",NA,"Sage Publications",NA,NA,"Cross Cultural Differences; Immigration; Indigenous Populations; Mental Health; Multiculturalism; Demoralization",NA,"http://search.ebscohost.com.proxy-ub.rug.nl/login.aspx?direct=true&db=psyh&AN=2014-06793-010&site=ehost-live&scope=site",TRUE,TRUE,TRUE,NA,NA,NA,NA,NA,NA,NA,NA
"361","PsychInfo","Journal Article",2020,"Zavala, Egbert; Curry, Theodore R.; Morales, Maria Cristina","Explaining the cultural retentiondelinquency relationship using differential support and coercion theory: A study of nativeborn and immigrant Latino youth.",NA,NA,"Objective: Although immigrants tend to have lower involvement in delinquency, increasing levels of acculturation to American society may lead to higher levels of delinquency. Conversely, cultural retention typically reduces such behavior. To explain these findings, this study employs differential coercion and support theory to predict that cultural retention is inversely associated with delinquency through associations with greater social support and less coercion. Method: Using a large, nationallevel sample of Latino nativeborn and immigrant youth, analyses are conducted using both ordinary least squares (OLS) and logistic regression. Results: Findings support hypotheses, showing that increases in cultural retention are associated with less coercion and more social support, both of which are, in turn, related to delinquency. Importantly, an initial strong inverse relationship between cultural retention and delinquency disappears when coercion and social support are controlled. Conclusion: Higher social support and lower coercion help explain the inverse relationship between cultural retention and delinquency among nativeborn and immigrant Latino youth. (PsycInfo Database Record (c) 2021 APA, all rights reserved)",NA,NA,"Social Science Quarterly",NA,"384941",NA,NA,20200301,101,"2",623,NA,18,NA,NA,NA,NA,NA,NA,"2020-21772-014","10.1111/ssqu.12776",NA,"Wiley-Blackwell Publishing Ltd.",NA,NA,"Coercion; Immigration; Juvenile Delinquency; Social Support; Latinos/Latinas; Acculturation; Society; Childhood (birth-12 yrs); School Age (6-12 yrs); Adolescence (13-17 yrs); Adulthood (18 yrs & older); Young Adulthood (18-29 yrs); Male; Female",NA,"http://search.ebscohost.com.proxy-ub.rug.nl/login.aspx?direct=true&db=psyh&AN=2020-21772-014&site=ehost-live&scope=site",TRUE,TRUE,TRUE,NA,NA,NA,NA,NA,NA,NA,NA
"362","PsychInfo","Chapter",2010,"Ali, Alisha","Exploring the immigrant experience through self-silencing theory and the full-frame approach: The case of Caribbean immigrant women in Canada and the United States.",1,NA,"The concept of silencing the self is grounded in the notion that the social world can shape one's behavior and one's self-perceptions in ways that precipitate a gradual alienation between the private self and the public self (Jack, 1991). Because the social world is constituted by the broader cultural milieu in which an individual and groups of individuals reside, silencing the self theory can be a powerful tool in examining the interface between self and culture. The theory can further be used to explore the process of transitioning from one culture to another, a process embodied in the immigrant experience. In this chapter, I describe the role of self-silencing in a particular type of immigrant experience: that of women who have emigrated from the English-speaking Caribbean to Canada or the United States. The basis for this discussion is a series of focus groups that were conducted in Toronto and New York City in which Caribbean immigrant women talked about the idea of self-silencing within the context of their lives as immigrant women. Through a comparison of the focus group findings from the Canadian immigrant sample and the American immigrant sample, it is possible to detect phenomenological differences in the role that self-silencing plays in adapting to the cultural context in the United States in contrast to the cultural adaptation described by the immigrant women in Canada. I contend that these differences, which I outline in this chapter, emerge from differing meanings and constructions around race, identity, and selfhood between these two host countries. (PsycInfo Database Record (c) 2020 APA, all rights reserved)",1,NA,"Silencing the self across cultures: Depression and gender in the social world.","Silencing The Self Across Cultures: Depression And Gender In The Social World.",NA,NA,"0195398092; 9780195398090",20100101,NA,NA,227,NA,14,NA,NA,NA,NA,NA,NA,"2010-08771-010","10.1093/acprof:oso/9780195398090.003.0011",NA,"Oxford University Press",NA,NA,"Cross Cultural Differences; Immigration; Major Depression; Repression (Defense Mechanism); Self-Concept; Alienation; Culture (Anthropological); Life Experiences; Privacy; Psychological Theories; Race (Anthropological); Self-Perception; Social Behavior; Social Environments; Communication Barriers; Female",NA,"http://search.ebscohost.com.proxy-ub.rug.nl/login.aspx?direct=true&db=psyh&AN=2010-08771-010&site=ehost-live&scope=site",FALSE,FALSE,FALSE,"T-102",NA,1,NA,1,NA,"Self-Silencing in Cultural Adaptation Experience Theory",NA
"363","PsychInfo","Dissertation",2021,"Hassan, Oluwasegun Bankole","Exploring the perspectives of West African immigrant families on active living among adolescent children: A grounded theory of study.",1,NA,"Accumulating evidence suggests that the risks of inactivity-related problems such as obesity are becoming a population health concern among younger age groups. High income countries show an elevated rate of physical inactivity among children. Low- and middle-income countries are beginning to experience a gradual increase in this trend. Canada is a highly industrialized multicultural society with nearly 22% of foreign-born individuals coming through the immigration process. Recent immigrants tend to experience a decline in their health status, over time as their years in Canada increase (negative acculturation effect). This phenomenon can be attributed to several factors including adaptation to the new sociocultural environment. While a great deal of research has focused on children, there is paucity of research in this area among West African children in Canada. With Saskatchewan being one of the fastest growing populations in Canada, this study sought to gain a deeper understanding of the perspectives of West African immigrant families in Saskatchewan and assess the impact of the sociocultural environment on active living among their adolescent children. Using purposive sampling, a total of 15 families residing in Saskatchewan were interviewed. Children between 10 to 17 years and their parents were interviewed in each family. A grounded theory methodological approach by Charmaz (2014) was used in this study. This involved an immersion phase, a conceptual phase, and a constant comparative analytical process. The analysis allowed for emergence of themes. Both the children and their parents reported having experiential knowledge of physical activity and benefits. The children and their parents also showed some negative acculturative experiences associated with active living. They reported facilitators of physical activity for the children such as school influence, peer influence, and parental role-modelling. The children showed an inherent interest in engaging in risky play. Both the children and their parents reported beneficial outcomes of engaging in physical activity together as a family. Finally, parental positive and negative reinforcements was reported in relation to domestic activities. This study contributes to a conceptual understanding of the knowledge regarding internal, external, and transitional factors impacting the active living and well-being of West African children in Canada. (PsycInfo Database Record (c) 2021 APA, all rights reserved)",0,"not theory","Dissertation Abstracts International: Section B: The Sciences and Engineering","Dissertation Abstracts International: Section B: The Sciences And Engineering","4194217",NA,"9798684603259",20210101,82,"5-B",NA,NA,NA,NA,NA,NA,NA,NA,NA,"2020-97495-069",NA,NA,"ProQuest Information & Learning",NA,NA,"Active Living; Family; Immigration; Parents; Physical Activity; African Cultural Groups; Grounded Theory; Peer Pressure; Childhood (birth-12 yrs); School Age (6-12 yrs); Adolescence (13-17 yrs)",NA,"http://search.ebscohost.com.proxy-ub.rug.nl/login.aspx?direct=true&db=psyh&AN=2020-97495-069&site=ehost-live&scope=site",FALSE,FALSE,FALSE,NA,NA,NA,NA,NA,NA,NA,NA
"364","PsychInfo","Dissertation",2014,"Lee, Minsun","Exploring U.S. imperialist influences on bicultural Koreans' identity negotiation: A critical theory study.",1,NA,"Bicultural identity has traditionally been studied in a contextual vacuum, with little attention to how asymmetrical power dynamics between two cultures influence the negotiation of a bicultural identity. This critical theory study used a focus group and follow-up individual interviews to illuminate how five adult bicultural Koreans residing in the U.S. negotiate their sociocultural identities within the context of U.S. imperialist influences. Interpretive phenomenological analysis (Smith & Osborn, 2008) and methods drawn from feminist research (Anderson & Jack, 1991) were employed to analyze the data. The analysis of the focus group and individual interviews suggested that participants were influenced by their experiences of immigration, racialization, racism, and racial triangulation in the U.S. Moreover, participants' accounts manifested hegemonic ideologies of color-blindness and individualism, and revealed a mixture of false consciousness and critical consciousness about racism within the U.S. That is, colorblind ideology and individualistic ideology appeared to obscure the role of racialization and racism, resulting in a false consciousness. At the same time, participants also manifested a critical understanding of history and the call for sociopolitical activism. Additionally, participants' narratives revealed internalized beliefs about the superiority of the U.S. versus the inferiority of Korea. Although most participants explicitly denied the impact of these factors on their bicultural identity, they implicitly acknowledged ways in which the asymmetrical power dynamics between the U.S. and Korea on the global stage, and between White Americans and ethnic Koreans within the U.S., influence their negotiation of sociocultural identities. The present findings have theoretical and practical implications for understanding and working with bicultural Koreans within the U.S. First, identity theory and clinical practice associated with bicultural Koreans needs to attend to the experiences of loss of power, racism, and assimilation. Second, it is important to attend to the role of ideologies in bicultural Koreans' identity negotiation. Third, there needs to be a focus on the influence of false consciousness in bicultural Koreans' identities. Finally, because bicultural Koreans' internalization of the inferiority of Korean culture appears to influence their identities as Korean and American, this internalization should be attended to theorizing about and counseling with bicultural Koreans. (PsycInfo Database Record (c) 2020 APA, all rights reserved)",0,"not theory","Dissertation Abstracts International: Section B: The Sciences and Engineering","Dissertation Abstracts International: Section B: The Sciences And Engineering","4194217",NA,"9781303323119",20140101,74,"12-B(E)",NA,NA,NA,NA,NA,NA,NA,NA,NA,"2014-99120-181",NA,NA,"ProQuest Information & Learning",NA,NA,"Negotiation; Interpersonal Control; Cultural Identity; Ideology; Latinos/Latinas",NA,"http://search.ebscohost.com.proxy-ub.rug.nl/login.aspx?direct=true&db=psyh&AN=2014-99120-181&site=ehost-live&scope=site",FALSE,FALSE,FALSE,NA,NA,NA,NA,NA,NA,NA,NA
"365","PsychInfo","Journal Article",2012,"Tartakovsky, Eugene","Factors affecting immigrants' acculturation intentions: A theoretical model and its assessment among adolescent immigrants from Russia and Ukraine in Israel.",NA,NA,"In this study, a new acculturation intentions model (AIM) was formulated to help explain immigrants preferences for different acculturation strategies and their further emigration intentions, i.e. their plans to either remain in the host country, return to their country of origin, or emigrate to a third country. The AIM applies the theory of planned behavior (Ajzen, 1991) to the case of immigration. In the present study, the AIM was assessed among high-school adolescents who immigrated from Russia and Ukraine to Israel as part of an educational program (n = 151). The adolescents completed questionnaires twice: half a year before and three years after their immigration. In accordance with the theoretical model, attitudes towards the country of origin and the host country and perceived environmental constraints (including perceived discrimination as well as perceived social support from parents, peers, and teachers) affected the immigrants acculturation intentions. In contrast with what was hypothesized in this study, immigrants psychological resources were not related to their acculturation intentions. The significance of these findings for both the immigrants and the host society are discussed. (PsycInfo Database Record (c) 2020 APA, all rights reserved)",NA,NA,"International Journal of Intercultural Relations",NA,"1471767",NA,NA,20120101,36,"1",83,NA,17,NA,NA,NA,NA,NA,NA,"2012-05339-008","10.1016/j.ijintrel.2011.02.003",NA,"Elsevier Science",NA,NA,"Acculturation; Adolescent Attitudes; Immigration; Intention; Planned Behavior; Adolescence (13-17 yrs); Male; Female",NA,"http://search.ebscohost.com.proxy-ub.rug.nl/login.aspx?direct=true&db=psyh&AN=2012-05339-008&site=ehost-live&scope=site",TRUE,TRUE,TRUE,NA,NA,NA,NA,NA,NA,NA,NA
"366","PsychInfo","Dissertation",2012,"Rusch, Dana","Family separation and mental health outcomes among Mexican immigrants: An acculturative stress framework.",0,"not theory","Serial or stage-wise migration is common among Mexican families and is characterized by a series of family separations, typically between parents and children. This pattern reflects the long-standing socio-political history between the U.S. and Mexico and is well-documented in the sociological literature along with discussion of transnational context. Despite data to suggest that serial migration separations increase risk for depression for both parents and children when compared to non-separated immigrant counterparts, few studies have specifically investigated the effects of these separations on individual-level and family-level outcomes. This study uses an acculturative stress model to examine the effects of serial-migration family separations on parent depression, family cohesion and general family functioning. Part of this study also served as a pilot phase for developing a measure to assess parents' appraisals of family separation and reunion experiences. Data were collected from a community sample of Mexican immigrant parents (N=53; 72% mothers) via surveys administered in Spanish by researchers. Seventy percent of the sample experienced a separation from at least one child during immigration to the U.S. A relatively high percentage (43.4%) met clinical cutoff scores for depression, but there was no significant difference in scores between separated status and non-separated status groups. These groups also did not differ on any family-level outcomes. Even though results did not support the proposed mediation models to predict depression or family-level outcomes, separated status parents reported significantly higher levels of acculturative stress than their non-separated counterparts. Pilot data suggest that negative appraisals of separation experiences were associated with higher levels of acculturative stress and depression, as well as poor family functioning and family cohesion. Overall, these findings endorse using an acculturative stress framework to understand the post-migration experiences of Mexican families in the U.S. Limitations of these findings are discussed along with suggestions for future research. (PsycInfo Database Record (c) 2020 APA, all rights reserved)",NA,NA,"Dissertation Abstracts International: Section B: The Sciences and Engineering","Dissertation Abstracts International: Section B: The Sciences And Engineering","4194217",NA,"9781124864389",20120101,72,"11-B",7087,NA,1,NA,NA,NA,NA,NA,NA,"2012-99100-257",NA,NA,"ProQuest Information & Learning",NA,NA,"Acculturation; Family; Immigration; Major Depression; Mental Health; Parents; Stress; Health Outcomes; Family Separation; Male; Female",NA,"http://search.ebscohost.com.proxy-ub.rug.nl/login.aspx?direct=true&db=psyh&AN=2012-99100-257&site=ehost-live&scope=site",FALSE,FALSE,FALSE,NA,NA,NA,NA,NA,NA,NA,NA
